input|output
"  ""Take Canyon on one last ride.""  Whoops.  What? Another item? You sneaky Billy. ""Lie on my back in the ocean. Just float."" Cool.  Why the ocean, Billy?!"|Okay, Finn, don't think about your fear. Just jump in there like it's no biggie. Do it for Billy. For Billy!
 Okay, Finn, don't think about your fear. Just jump in there like it's no biggie. Do it for Billy. For Billy!|I'm afraid. I'm afraid! Oh, dang, here he comes! Here comes the Fear Feaster!
 Huh? Uh, hey, man, don't do anything stupid. Hey! You're too chicken to face your fears with open eyes? This stank is cheating!|This stank is for Billy. 
 No! |Huh?  Aaaaaaaaaaaaaaaah!
 Huh?  Aaaaaaaaaaaaaaaah!|For Billy!
 Wake up. Wake up!|
 |Huh? Whoa!
 What?! |Was that you or me? Huh? Hey. Hey! I—I'm doing it!  I'm not afraid of the ocean anymore! I'm doing it, Billy.
 You finished my list. Now I can rest like a great hero. Thank you, Finn.|You're welcome. Canyon helped, too.
 Tell Canyon I watch her sleep. Man, love is weird, Finn.|I know. Is that the thing you wanted to tell me?
 No. Goodbye.|Wait. Billy!
 What?|What's the thing you wanted to tell me?
 Oh, uh, you must go to the Citadel. That's where your father is.|Joshua's not alive. Me and Jake buried him behind the—
 Not Joshua! Your other dad. Dad the Human.|What?
 Laters.|Jake, where were you?
 Come on, man! I don't even take Lady up there.|Dude, I found out my human dad is still alive.
 Whoa, what?| He's at some place called the Citadel.
 Whoa.  Are you gonna go see him?|I don't know. Maybe I shouldn't. Maybe there's a good reason why he didn't raise me. Like, he was probably captured by thieves and kept a slave for years.
 Yeah, or maybe he was ambushed in the wild and hid you so you wouldn't be captured, too.|Yeah, maybe it's better not to rock the boat.
 But... it might also be good to find out if you have any genetic risk factors or allergies or whatever. Plus, you get to see what you'll look as an old guy. Could be cool.|Heh. I guess it would be okay to meet him, just to know what I'll look like.
 Whoa! You guys do not wanna go there. Seriously.  Check this out.  The Citadel is a nasty-sized prison. Only the worst of the worst end up there. Real stink faces. These guys are the pits—the armpits.|Hey, my dad must be like the warden there.
 Check it out! I got gifts for you guys.|Ha, cool it's a penlight.  Jake, don't look directly me in the—Aaah!
 Oh! One last thing, dudes.  Whatever you do, don't wake him up.  Okay, you can go now.| Pew! Pew!
  Pew! Pew!|You ever wonder what happened to make a place all wrecked up like this?
  Hey! Get out here, old man!| Dude, shh. Don't wake him up.
  Hey, get out here, old man.|Pizow! 
 Pizow! |Old man.
  Uh oh!  Finn, a little help?|Bizzow
 Gizzow|Let's hoof it!
 Let's hoof it!|Jake, don't jostle the package.
 Jake, don't jostle the package.|Yahct!  All right! 
 Yahct!  All right! |There's too many of them!
  Dude's got serious night terrors. | What now, Prismo?
 Yeah,  I just wanted one last look at myself.|Wait, this old man is you?
 Killing a wish master is a cosmic crime. Once I'm dead, the guardian will show up and take you to The Citadel.|I don't think seeing my dad is worth sacrificing your life
 Prismo, don't worry! I'll put the old man to sleep and get you back!|Dude! That means The Lich jacked our entry into The Citadel.
 Hello!|Wait, wait, wait, wait!
 Wait, wait, wait, wait!|Look, Jake.  More guardians. The Citadel, I presume.
 Likely so.|Hey. Do you think maybe one of them could be my dad?
 Eh, I don't think so. We'll probably know when we see him.|Right, right. That makes sense.
 Right, right. That makes sense.|Hey! The Lich again! This must be where the prison cells be at. See? Good riddance, too. I hope you rot forever, you awful jerk-clapper. Some people just make the world a worse place to be in just by being around, Jake.  That's right. Bad apples. Lock 'em all up, I say. At the bottom of the ocean, where it's too dark to see.
 Look at that weird ol' kid over there. He looks just like you.  Man, look at his clo—|Daddyyy!  Aah!  All locked up in there. D-Do you think maybe he's a criminal too?
  Well, it had crossed my mind.| Jeez, man! Now I wish I hadn't said all that stuff before. Now my heart feels yellow and green.  Maybe we shouldn't even have come here—waah!?  Jake, what did you do?
 It wasn't me! It came from up there!| He's melting the crystal all up!  Breaking cats out left and right! Turning cats gray! Did he trick us again!? I think he did!
 Thanks, kid. Now, where'd you guys park your Star Skipper?  This place is coming down quick, and I mean quick, like zip zip. Like wow, like boom boom wow.|Oh. We... we don't have a Star Skipper.
 Son? Oh, hey, good for you, kid. In other news, I still gotta get out of here and the ground is melting. Huh?  It's all pooling in the center.|Hey, um... I... I wanted to ask you something. I... well...  Hey, wait up!   Dad, wait!  Dad, I need to ask you —- aah! 
  Finn, I know we normally come out of these things okay, but I got a bad feeling about this. Just promise me, if both my eyes get fried off, you'll fry yours off too.|What? No.  Listen, you don't gotta worry about a thing, Jake ol' pal.  We just need to defeat those five space villains, hijack the shard they're hijacking and sail it home to safety.  Easy peasy.
 Yeah, Jake, smarten up. As soon as the last guardian dies, the fighting stops. See? He's bitin' the dust right now.|Aahh! Uh oh! 
 It's-- It's okay. It's okay.  You just gotta fetch me a gob of that guardian blood, son. It's got that good nooch that keeps us young in the crystal.|Nooch?
 Come on now, partner.  No dawdling, yer old man needs ya. |
 Hey, good job, son! Now, rub some of that sap on my leg there. Make sure to get it into the chicken wing hole.| Dad...
 Martin!|Okay, M-Martin. We need to talk.
 Yeah, okay, kid, but hurry it up. I'm trying to act cool here, but this thing really stings!| Why'd you abandon me in the forest when I was a little baby!?
 Oh... I mean... Heh. You know me. I'm a funny guy!|
 Dude!!  S'mores important junk happening! Look!|It's time to peel bananas on this fool, as a family!  How about it, Martin?  Dad?
  I gotta run to the store!| Hrm.  Wha?
 I will command a great and terrible army; and we will sail to a billion worlds. We will sail until every light has been extinguished. You are strong, child. But I am beyond strength. I am the end.  And I have come for you, Finn. | What? You don't like this stuff, huh?  Whoa!  Right in the doorbell.  Dad.  Jake, finish off the Lich. I gotta go catch my dad.
 Finn, forget that loser!|Dad, wait!
 Hey, cool guys. Looking for a new boss?  Chew faster, that guy's really moving.| Dad! Stop!
  Finn! | Martin, I won't let you escape!
 It'll be okay, dude.| I mean, at least you finished off the Lich, right?
 |Huh?  Oh, my garf! What are they?!
  It can't end like this.| James!
  James!|I wanted to do it. Why didn't you let me?
 |Wow. James sacrificed his life for you again, PB.
 Yeah, that's like the twenty-fifth time, right?|Yeah, obviously we'll have to re-clone him.
 James is too reckless. I can't reward this kind of foolish behavior forever. It's time James takes his eternal nap.|But it's James!
 I'm putting my foot down. There will be no more Jameses.|No...
  And remember the time James saved PB from that contaminated cupcake?|Yeah, he ate that whole cupcake. What a guy...
 Yeah, he ate that whole cupcake. What a guy...| Is this... James heaven?
  Jameses!  Alright, who's in charge here?|James...
 Well... I was lonely! I knew Princess Bubs would make a new James if, you know, a James died a hero. So...|You faked your own death?
 Yeah! I just wanted a friend.  Someone who gets me!|James...
 Plus, each time I get kerplonked, I get another shiny medal, and why have two medals if you can have all the medals? Medals, medals, medals...|Dude, I've been to your funeral like twenty-five times.
  PB ain't gonna like this.|Hmm hmm!
 Nah, man. PB's no dummy. She'll find out. It's only a matter of time.|We like you James but, you're on your own. We're gonna sit this one out.
 We like you James but, you're on your own. We're gonna sit this one out.|This should be good.
  What a show!|Very enjoyable!
 Okay! Weeoo weeoo weeoo weeoo...  Ah! Can't fight! |Yoink!
 Hey!|Heeyah!Aww! Don't touch the monsters! They'll melt you! Oh my jerbs! Jake! Let's help these candy orphans!  Hey kids! 
 I hereby award thee...Jameses...These medals for bravery.|Dat's my boi, Jameses!
  MY ARM!!!|   Oh!  Parm, parm, parm.  Asiago's like parm.  Whoopsies.   Okay, now easy does it.
    Oh!  Parm, parm, parm.  Asiago's like parm.  Whoopsies.   Okay, now easy does it.|Ohh!
 Ohh!| Thanks a lot, Dad!
 Finn?  What's going on?  Is the spaghetti all—whoa!  Finn, what happened?|I... messed up the spaghetti,  and then I got mad, and PB's candy arm exploded.
  Man, I knew that arm was bogus.|Yeah, it wasn't the greatest. Sorry about the spaghetti, though.
 Man, don't worry about that.  You just went through some outrageous beeswax from losing your favorite arm and et cetera. You can't just expect to bounce right back to normal.|I can't?
 Nah, man. Listen.  All these princesses donating all these gross fake arms—they mean well,  but they're throwing you off your game! You got to go at your own pace. If you listen  deep in your melon heart...  that's where the real instructions are.| My melon wants to punch my dad in the face and steal his arm.
  Well, those things are bad,  so they can't be the real instructions, but you keep listening. Me—I'm going to go to the spaghetti store and buy a new mop head. I'll be back soon. Just remember—listen to your melon heart. | Melon heart... melon heart... man, I don't know. It'd be so easy if I could just go find him—my dad that is. That portal he went through after ripping off my favorite arm went right to outer space. And outer space is up there somewhere... I'm told. Maybe Banana Man could help me build a rocket or something...  or some stairs or... something, something, something... or, or, or.   Wow, it's like a—like a—like a magic Finn arm.  She's powerful. You must've exploded the candy arm before and made the rock pile just know. It's almost like I'm trying to tell myself something, like a message from my melon heart.
  That means lay off. Finn's feeling this one out solo style. Give the kid a chance.| Daddy's got an arm and baby's gonna harm his arm by tearing it off his dad.  Baby's building a tower into space. Space is where he's gonna find his dad.  Daddy's got an arm and  baby's gonna harm his arm by tearing it off his dad.  Baby's building a tower into space. Space is where he's gonna find his dad. Daddy's got an arm, and baby's gonna harm his arm by tearing it off his dad.
  Ahh!| Oh, hi.
   Get out of my house or I'm going to face blaaaast you.| Hi.
  Hi.| Waah.
   Yep, yeah. I know you. You're one of those swimmers right? A reeeal swim nut.| What? No, I'm Finn. 
  Well you can't swim in me. Not anymore, I'm not water. You can't get me up your nooooose. |  Okay, I'm going to keep going.
  I'm going to keep going, into here. |  Oh, baby's a tower into space. Space where he's gonna find his dad.
   Goodnight buddy, I'm proud of you.|  Baby's building a tower into space, to tear off his dad's arm.  From like where that round of the arm bone meets that weird flat bone on the top of the back. Gonna pull that until it comes off. Baby's building a tower of revenge...
  Hey kid.  It's me again. Carroll, my name's Carroll.| Finn.
  Finn, look I'm sorry about blasting you yesterday. Hey man, are you really gonna do those things?|  Uh, yeah, for revenge. I think it'll feel good.
  I get it, I get it. But let me tell you something. I used to be water. Like a pond or something real wet. I used to hate people swimming in me,  kicking and stuff. So what did I do? I evaporated, I got myself out of there.| You should have pulled off their legs.
  No, no, no, no, no, no, no. Listen, you have to stop obsessing about revenge.  Umph.  Be like me and run away, you have to run away and never stop hating your old life.  You gotta really dwell on it. Ah!| What was that?
  I just thought about my anxieties and it's like my mind hand touched a hot memory stove.| Hmm.
  Ah!| Interesting. Oh hey, what are your thoughts on melon hearts?
   Finn! Hey what's it like up there?  I figured I could turn into spaces, or something.|  Daaaad!?  Ah. Oh man. My nog master.  Hello?  Hell-oh!  Hey, hey dad?
  Huh? Oh good, you're awake.|  Gotcha! Ha, ha, hee, hee, hee, hee.  Give, give it. Give me the... give me give it. Give me the...
  Oh, my favorite arm.|  Butts. Butts.
  Didn't help much did it.| No. Wait, what?
  Bong Bong.  Sorry buddy.| PB? Wait, where am I?
  We're in the Candy Kingdom fallout shelter.  I brought you here after you passed out on the tower. You were hallucinating like crazy so it was really easy to trick you. I figured you'd thank me later after learning your lesson.| Right, right.
  And look, the arm is gone too. See?  So what do you think?| Hmm.  Yeah, okay. Thanks Princess.
  Oh, hey buddy you're back. How are you feeling?| Um, neutral I guess. I don't want to punch my dad anymore.
  Ha, Ha! That's great!  You can always trust the old melon heart to get you through.  So I guess we won't be needing this thing anymore. You wanna do the honors?|  Yes I do.
  Hmm....|What is it?
 It's looking droopier.|But I've been pounding pickle juice like I was preggos. For the electrolytes.
 Well, switch back to water. But what I really want to know, is how are you feeling Finn?|What? Oh, I don't know. , I guess I don't feel anything. Bleh. 
 Okay, that's what I thought. You gotta bounce back, man. You got burned by your bad dad, you lost your arm, and all the ladies say you don't talk to Flame Princess no more.|Who's sayin' that?
 Finn, flowers thrive on good vibes. As your doctor, I'm ordering you to go out and have fun, okay?|You want to go with me to Crab Princess' party tonight?
 Uh, what? Like... as a date?|Sure. That would be fun, right?
 Finn, I don't date my patients.|It's cool. Guess I'll go make out with Crab Princess.
" Okay. Tell her I said ""hi."""|♪I'm lost in the darkness, what will this bring? Autumn descends on me,Autumn♪
 ♪What do I see? Oh, so beautiful. My heart it beats. Oh, so magical.♪|♪I'm lost in the darkness, what will this bring?♪
 ♪I'm lost in the darkness, what will this bring?♪|
  Hey, Finn, could you pour this juice into my mouth?|What? Pfft!  Aah!
 I can't reach my juice.| Yo, come on bee! Geez!
 Oh, I'm so sorry, I didn't realize—|Didn't realize what? That there's a person attached to this flower?
 Uh, yes. I'm sorry. But it's only because your flower's the greatest miracle of all time. It's just doing something to me, I—|Oh, that's cool. Thanks, beezy.
 So uh, what are you doing here? Heh.|Ah, well, I came here to make out with Crab Princess, but I sort of lost steam on the walk over.  I don't know what crabs are into. I'm just gonna stop trying and let my flower wilt away. Who cares?
 I'll try for you, man.|Whoa! Really?
 Thanks for walking me home, Finn. I'd invite you over, but you can't breathe underwater, right?|Not usually, but can I have a kiss, please?
 Uh, okay...|Okay. Good night, Crab Princess.
 Hey, you did it!|Oh, you're still here.
 Yeah,  just checking in... on my buddy. So, how you feelin', buddy?|"Pretty grease. I made out with Crab Princess, so that's grease. But really I don't feel nothing. Maybe if I made out, I will feel something? Maybe I'll reach a ""good vibe"" saturation point. And then my flower will feel good, too..."
 Your flower feels good, yes.| Hey, cut it out, Breezy.
 Ha ha! I'm just messin' around. We're buddies, right?|Yeah, Breezy, I like you. You're a good wingman.
 |
 |What's up with your head?
 Whoa. You're a dead ringer for Flame Princess, with a smidge of Princess Bubblegum mixed in.  Guess you're still hung up on both of 'em, bro.| I ain't hung up on nobody! Nobody. Breezy, let's get out of here.
 Okay.|She doesn't look anything like Flame Princess, does she?
 I don't know who that is.|Exactly.  I'm just trying to have fun. You know, doctor's orders. But I still ain't feelin' nothing.  maybe I should just let this poor flower die.
 Noooo... Listen, buddy, being a free spirit is fun and all, but you got a responsibility to that flower, just like I got a responsibility. Get this—I'm actually a virgin queen bee. I was born to lead a hive, destined for a life of obligation and ritual.|Whoa. Bummer.
 Yes. Once I drink of the royal jelly, my carefree days are done.|Dang. That sounds like raw deez. Breezy, you got to stay free... Free to make out with whatevs. 
 Yeah, maybe you're right. You know, it's too bad we're such great buddies or we could make out with each other. |What?
 That's right. Everybody's havin' fun...|Whoops!
 Girl, get back to your hive! Quit hanging out with that bologna tube! It's disgusting!|Mnh-mnh.  Yo! Shut it! She's an independent lady!
 Gonna teach you to mind your b's and q's, chump!  Buzzzzz!|Uh! Run, Breezy!
 Uh! Run, Breezy!|Aah!
 You're about to get waggle-danced, you chicken!  Unh!|Ow! Ooh! 
  aha!  Don't worry, Finn!  I jacked some royal jelly from their hive! | Breezy... No!
 Hey, honeybuns!|
 Whoa! Oh, No! She got into our secret sauce, bro! It's all over!  Long live the queen!| Breezy?
 Yes, Finn. Can't you see? I've become a queen to save you because... I love your flower and—and I think... I love you!  Now you can partake of my pollen crumbles and become my drone.|Um... You know, I'm—I'm trying to keep it casual, B. I just don't feel the same way. I don't feel anything.
  But I royal jellied for you. |I'm lost in the darkness, Breezy.
 Wha? Where you going?|That's it. We made out.
 Wha—What?! I didn't wait infinity for a dip in the kiddie pool! We're taking this to the deep end!|But I'm not a good swimmer.
 Don't be scared, Finn. Lumpy's on lifeguard duty.| How's it going, guy? Is any of this helping?
  How's it going, guy? Is any of this helping?|I'm gonna forget you did that. Right in the vault.
 I'm gonna forget you did that. Right in the vault.|Whoa, whoa, whoooooa!
 Whoa, whoa, whoooooa!| Yeah! Whoo-hoo!
  What the lump? Oh, hey! Finn, you got your arm back!| Whoo-hoo! Yeah! Whoo-hoo! Breezy...
 Whoa-a-a!|Hmm. Why would I need to learn about caterpillar families? I don't get it.
 Well, they look like they're having fun.| Real leaves aren't made out of candy. They always have a gross, bitter taste.
 Mmm! Ah, it's so good!|Ugh. That's gross, too. There's no way real caterpillars are delicious.
 You guys, this is lame.|No way I'm eating a bug's butt. Those kids are right. Whats the big deez about the food chain, anyway? Lets hit the snack bar and eat something yummy.
 No way I'm eating a bug's butt. Those kids are right. Whats the big deez about the food chain, anyway? Lets hit the snack bar and eat something yummy.|Hey, this is pretty fun!
 Hey, have you noticed we are birds now?|I'm hungies.
 |Oh, dude, you ate those?!
 Come on, man. We're sweet, sweet birds, and we get to eat worms. This is a unique experience.|
 |
 | Uh, how did I get so mad chubs? I only ate one grub.
 Dude, you've been eating grubs for hours.|What?!
 Yeah, you're a beast.|Help me, Jake! My body's too bloated to fly!
 Hide!|
 | There goes my din-din. Why am I hungry again?
  There goes my din-din. Why am I hungry again?|Jake!
 Who are you?|It's me, Finn.
 Dang, when did you get so big?... And old?|
 You feeling okay, bro?|Jake, we are good friends. So let me just say you look awesome right now.
 Ha, really?|Yeah.
 Yeah.|You're looking tasty.  Hey, why don't you take a seat in my mouth?
 Why? That's... weird.|It's okay. It's okay. Just give it a try. It's a new experience, right?
 Wow, you have a lot of saliva.  You must have a broken pipe, old timer. It's comfy, though.|
 Whoa! Did you just try to eat me?!|No...? But if I did that'd be okay, right?
 You are trying to eat me.|I'm just following the Law of Nature.
 What're you talking about?|I don't know. I just feel that way. 
 |Aw, Jake, you're missing out... by not getting eaten... by me.
 Sorry, man. I'm not into it.|So alone. So hungry.  The Law of Nature... has claimed this... bod... 
 So alone. So hungry.  The Law of Nature... has claimed this... bod... |Yay! What a big turnout. Top notch! To decompose stuff! Yeah-h-h! We are so pumped! Yeah!  What's that smell?
 Yay! What a big turnout. Top notch! To decompose stuff! Yeah-h-h! We are so pumped! Yeah!  What's that smell?|Wow. It looks amazing! Yay! Yay!
 Wow. It looks amazing! Yay! Yay!|Party time!
 Party time!|So good! Awesome. This bird went bad so well!
 You took it too far, man. I'm a dog, and I eat all kinds of horrible things. This is disgusting.|"Come on, think of it as a conversation starter—like, ""The other night, I ate the grossest thing I've ever tasted."" You know, it's interesting. "
" Come on, think of it as a conversation starter—like, ""The other night, I ate the grossest thing I've ever tasted."" You know, it's interesting. "|Whew! I'm full.
 Whew! I'm full.|Whoa! Aah!
 Whoa! Aah!|Whoa! Aah! Whoa! Aah! What's going on?! Whoa!
 Whoa! Aah! Whoa! Aah! What's going on?! Whoa!|
 |
 |I think we're safe now... and also caterpillars.
 We're still in a bind, man. No food, no water.|I'm hungry.
 Huh? You okay? |She's beautiful.
 Yes, I have to hurry and find food. Otherwise, my family won't survive.  But I don't know if I can go on... |Hold on, Erin. Food! Water! Shade! Where are you?!
 Over there—the oasis!| Yummy!
 Really? You like leaves now?|So good, dude.
 So good, dude.| Your eyes.
 So, how many kids you want to have?|Uh,  d-d-do you want to get married?
 And will you, Finn, take this caterpillar to be your wife, even if she becomes a flower or a bird or a bacteria, to love and to cherish till death do you part?|Y-y-y-yes.
 You may now kiss the bride.|This way, Erin!
 Finn!|When we're reborn as caterpillars, I'll marry you all over again!
 Hey, why are you eating caterpillars?|My eyes are open.
 Princess, he did it! Root Beer Guy set up the force field!|But he sacrificed himself to do it.
 Yes, it's been a difficult adjustment.|Blaze his face, Eli!
 Finn, his weakness is his brain seed.|Okay!
 Okay!|Whoo-hoo-hoo! Whoo-hoo!
 Whoo-hoo-hoo! Whoo-hoo!|Oh, uh!  Aah! 
 Hey, where's Finn?|Hi.
 Okay. Y'all bring food and bevs. Finn, you make the guac, all right?|I'll make the guaaaaaaaaaaac.
 Finn! Finn!|Yo! What's up, APTWE?
 What do I do now?|Dude, I don't know. Probably not go back in the basement. You're so big'uns. You should be free, boy.
 Free to do what? I need psychic commands.|Can you help me dice tomatoes for this guac?
 No.|You see, man, I feel weird giving you orders. You should just do your own thing. Realize your potential.
 But this is what I am—a war machine who serves its master.|No, man. You're more than that.  Whoops. I see into your brain, remember? You'll do great. Just go for it. I believe in you, man.
 No, man. You're more than that.  Whoops. I see into your brain, remember? You'll do great. Just go for it. I believe in you, man.|Oh, word. Thanks.
 Maybe Darren was right. There's no place for my ancient ways. |Don't think like that, dude! Come back and see us whenevs!
  Whoo!|Whoo! Whoo-hoo!
  Yeah? Yeah. Send them on over.  Sorry about that.  Anyway, as you can see, this beauty offers direct first and second floor access. Superb craftsmanship and etcetera. I suppose you're familiar.  Yes, Finn?|Yeah, uh, when are we going to get our house back?
  Good afternoon! Yes, right this way.  I've got 37 available units to show in this building so we're going to want to get right to it. Please step inside.  There you go. Is that everyone? Good, good. Please make your way upstairs and we'll begin the tour.  And you two make yourselves at home. Rent's due on the first, no overnight guests. Oh, and flush once after you boom-boom but before you start using the TP, and then once more in the middle of using the TP if you're going to use a lot. It's easier on the pipes. Okay. Call me if you need me. |
 Hey Finn. I'm real sorry about this. Somehow I feel like it's kinda my fault.|Nah man. It's really not so bad. Let's just sleep on it tonight. 
 You're gonna sleep... like that?|Yeah, man. It's tough. I'm a tough kid.
 Haha, yeah. I can't wait to wash my gross, fat butt. |
  I just feel if we're patient this whole thing will work itself out before you know it.  Haha! See, man? Help is on the way!| Man, can I tell you something? I don't even know what's going on here. I mean like, what the heck is a deed? How come he can buy our house when it's OUR house and Marceline gave it to us and we live there?! A-and now we're arrested?! This is crazy! It's crazy!! 
 Man, don't you know? The laws ain't made to help earthy cats like us.|They're not?!
" Nah, man. Listen. Here on our planet, back in the old days, back in the REAL old days, it was just every man for hisself. Scrooblin' and scrat-scroblin' for the good stuff, the greenest valleys, and scrat-scroblin'. And the strongest, meanest men got the best stuff. They got the green valleys and were like, ""The rest of you, y'all scrats get sand!"" And THAT'S when they made the laws, you see. Once the strong guys got it how they liked it, they said, ""This is fair now, this is the law."" Once they were winning, they changed the rules up."|Woah, just like Kim Kil Whan!
 Haha, that's awesome!|Yeah, awesome!
  Man, where did I go wrong?|I don't know. But I'm not tryin' to be sleepin' on a ladder anymore, so let's just get a bunch of scroot together and buy our house back. Then you two can hash it out later.
  Yeah, you're right. So, wanna rob a bank or somethin'?|Well, actually...I was thinking maybe Kim Kil Whan was right.  Maybe we should get jobs or somethin'.
