input|output
 Pick up that platter, tough guy.|Old Mr. Cream Puff?
  We used to date. |Something's happening! Come on, come on...
 Work.|Algebraic!
 Ew!|Hey, look, the decorpsinator serum is working!
  Rah. Must eat sugar!| You're grounded, Mister.
 Oh, this is really bad. They're going to be attracted to the Candy Kingdom!|Why?
  Gimme some sugar, baby.|Chew on this! 
  Good one, Finn. Quickly, to the kingdom!| Get a life!
  Hurry, sweet citizens.|Alright, you heard the princess, everyone in! Alright, no pushing, come on!
 Dude, what's up?|The princess will explain everything. Tree Trunks, get those hot buns in here, girl.
  Oh, I hope it's not bad news.|Did we get everyone?
 All present and accounted for.|Thanks, Manfried.
 Citizens, we are assembled here in the candy foyer for a momentous announcement. Tonight we are all going to have... a slumber party!|What?!
 What?!|Wait! What about the zom--?! 
 Go ahead and start partying.| But, Princess, the Undead--
 Finn, the Candy People can't know about the zombies.|Wha?!
 If they knew, they would flip out.|"What do you mean ""flip out""?"
 Princess? It's me, Starchie the gravedigger. I brought you a larger corpse shovel. Oh, Princess? Well, I'll just wait for you here, then. By the mausoleum. With my back turned. And my defenses lowered.|Candy People explode when they get scared?!
 Not telling the Candy People about the zombies is so important that you need to promise, Royal Promise, not to let anyone find out about the zombies, ever.|Okay, sure.
 No, Finn. You have to Royal Promise.|Yes,  I Royal Promise.
 Now I must cloister myself in the lab and finish the equation to my decorpsinator serum. You keep the candy folk distracted and ignorant. Can you do that?|Yes, your highness.
 Good. Don't tell anyone about the zombies. Never ever. |No, wait. Can I at least tell  Jake?
 Tell me about what, dude?|You know, about the outbreak of zom-- 
  Alright, what's going on?|Uhh, nothing at all, buddy! 
 Hey, dude. I think you and Bubblegum are up to something.| Ahha ah, what? No, no way.
 Whoa, you guys are up to something. Is it some sort of prank? Can I get in on it?|" Who wants to play ""Truth or Dare""?"
 Hmm...|Ok, Chocoberry, you may ask someone to tell a deep truth or a saucy dare.
  Hey seriously, man. I'm your bro. Bros are supposed to tell bros everything all the time. What are you and Bubblegum up to? Is everything alright?|Yep! Fine! Everything is great! Heh, heh.  Except for that. Whoa.
 I can't eat chocolate or fudge 'cause I'm a dog and they'd probably kill me, but hmmmmm probably... neither. Finn! Truth or dare?|Dare! Haha!
 I dare you... to tell me the truth about what's going on in your mind. What were you and Bubblegum talking about when you were alone together?| Umm, ahh, the truth is, ahhh...
 You promised you wouldn't freakin' tell anyone! Oh, you're so cute, Finn.|Ahhh... the truth is... that I'd rather play Dodge Socks!
 I'm not playing dodge socks 'til you stop dodging my questions. Hey...  Old Mr. Cream Puff? Isn't he dead?|Hey, give me my sock back! Dodge Socks was a bad idea!
 Whoa.  Look dude, just tell me what's up, 'cause you are crazier than a cannonball tonight.| Oh, my goodness! Princess hasn't finished the equation and the zombies are here!
  Oh, my goodness! Princess hasn't finished the equation and the zombies are here!|I, uh, she just want this slumber party to be super fun, and if I did have something to tell you, then I would in a second, and it would make my life easier, unless there was something stopping me, like a promise, but there isn't, so I won't, so it's cool.
 What? You lost me.|Umm... Hey, you know what time it is?
 Adventure time?|No, time for Seven Minutes in Heaven! You're first.
 Really?|Lady Rainicorn! In the closet with Jake!
 Okay, okay, alright.  But in seven minutes, I'm gonna come out and make you spill your beans, Finn.|I can't hear you all the way in heaven!
 Umm, does anyone else hear that?|What? Hear what? I, I don't hear anything.
 I hear something I don't understand... and it makes me scared! |What? No, Chet. Everybody, wait. What noise? You mean this noise? 
 Oh. |Yeah! Dance it! Bust it up! Uh! Uh! Uh! Oh!
 What is this game you are playing at now, Finn?|Uhh, it's... Blockado. Haha, the game of barricades. Come on, let's block all the entrances and windows!
 Uhh, it's... Blockado. Haha, the game of barricades. Come on, let's block all the entrances and windows!|Alright, this is not a permanent solution. Think Finn, how can you keep everyone from finding out?
 Find out about what, Finn?|Manfried, the talking piñata! Your convenient appearance gives me a great idea. Everyone, grab a stick! New game! We're gonna smash some piñatas!
 What?|Except for you, Manfried.
 Oh, thank goodness.|Now everybody don these blindfolds.  Thanks, Taffy Girl.
 Now everybody don these blindfolds.  Thanks, Taffy Girl.|Alright, everybody, get together. I'm hanging the piñatas...  They're all around you. Smash the piñatas!
 Alright, everybody, get together. I'm hanging the piñatas...  They're all around you. Smash the piñatas!|Yeah! You guys are on fire!
 Oh, it is so tasty.|Yes! We did it! My improbable plan worked!
 Seven minutes up yet?  Whoa!  What the nuts happened here?!|Oh, we killed all the zombies that Princess Bubblegum and I raised from the dead.
 Really!?|Jake? What's going on?
 What? Huh? Oh, Finn! Did you break your Royal Promise?|Yeah, but, I mean, all the zombies are dead. The Candy People won't freak out. What's the big deal?
 Finn the Human. You have broken a Royal Promise for which the penalty is trial by fire.|That's stupid.
 ...Math questions!|Mathematical!
 Finn, you're terrible at math.|Awww.
 Now, solve this! |Uhh....
 Yes! Two plus two. Solve it or die.|Uhh. Four, right?
 Oh, correct.|What's happening, Princess?
 You've defeated the broken royal promise! The Gumball Guardians are resetting!|"Slamacow! That was tops! Who's not good at math? I was all ""Four!"""
 Four, four... Four, four, four... That's it! The answer was so simple, I was too smart to see it!|You're welcome!
 Golly!|Woohoo! Yeah!
 I hope you grasp the full consequences of breaking promises.|Heck yeah! If I break a Royal Promise, I get to fight zombies, throw slumber parties, awake Gumball Guardians and... and...
 Alright, alright.| And reverse death itself!
 Oh, you are adorable. But keep your promises, okay?|I will, Princess.
 I will, Princess.|Starchie, you're not a zombie.
 I can't help it. Flesh is delicious!|You're delicious!
  Bouncing!| Princess, this tea party sucks in a big way! But thanks for the invite!
  Oh, don't worry, Finn. The Mallow Tea Ceremony takes years to master.| Princess! I think I just now mastered it!  One more bounce.  Alright!  Unh! Tea partying's hard, huh, Jake?
  What?! No way! It's super easy!| Lumpy Space Princess, you big faker! You're floating, not bouncing!
  Oh, my gosh. Oh, right. Sorry.| Dude! Your leg!
  Nah, that's no bump. It's the early stage of the lumps.| Is it serious?
  It just means he's changing into a Lumpy Space guy, on account of my bite. It's just like, um, y'know... werewolf rules?  Ar, rawr rawr rawr rawr rawr rawr!| Oh, no!
  What? You think I'm gonna turn all lumpy like her? Get outta here.  Wha? Finn, I think I'm freakin' out!| Calm down, bud! I'll... I'll sock the lumpiness outta ya!
  He'll be lumpy, like, forever.| LSP, please! Can you tell us how to reach Lumpy Space?
  Don't go telling everyone about this portal or whatever. It's kind of a secret.| Where is it?
  Good day, Princess. Is your father okay with you entering Lumpy Space with two...  non-Lumpers?|  Just say yes! Yes, yes, yes!
  It's up there at Makeout Point.| That's so close! We can run there in no...  ...time. Aww, what?!! It's, like, a million-mile fall into space!
"  I SAID, ""LUMP OFF,"" MOM!!! "| Uh...
   WHAT?!?!| Vroom vroom??
  Shucks! I lumping hate them! I'm really, really sorry, Finn. But I can't help you because my parents are horrible idiots.| Don't you know anyone else with a car?
  My friend Melissa has a car. But she's dating my ex-boyfriend Brad.|  Call her NOW.
  Hey, Melissa. What's up?| What's she saying?
  Oh, Glob. I forgot.| What'd she say?
  Tonight is the weekly Promcoming Dance!  It's gonna be so flipping awesome!|  LSP, we don't have time for this. Ask for the ride, LSP.
  Oh, oh, oh, oh, oh, oh, oh, oh—  Wha?!|  Melissa,  you should totally drive us to Makeout Point to make out with hot boys!
  LSP, you're so baaaaad... be there in a sec!| Biyah. 
  Hmm. |  Sorry. But Jake's lumpiness is worsening!
  Hi!| Ugh... OKAY! Let's go, let's go, let's go!!
  Aw, Finn, this music ducks, right?  Ah. I love this song. We should totally TP Shandala's house!  Gracious! That was terrible! Finn, if you can't save me from the lumps... if I do turn... if I become lumpy like them, I want you to—|  It's not gonna come to that. But if it does, I'll bury you beneath the nicest, most shadiest tree!
  Whoa, whoa, whoa, whoa! I'm saying that if I go totally lumpy, then I want you to get used to lumpy Jake. What did you think I was sayin'?| Oh, um...  Heh heh.  CAN'T THIS CAR GO ANY FASTER?!
  We've been here for, like, five minutes.| Finally! Huh? This doesn't look like Makeout Point.
  This is Brad's house. You wanted a ride to Makeout Point? You think I want to make out with you?!| Uh...
   Well, maybe I do, but... wait.  I HAVE A BOYFRIEND, FINN!! | LSP, we gotta hurry! Jake's running out of time!
  This is it.| Let's go!
  Wait. Watch yourself, Finn. The guys who use the antidote up here are notorious for being...  smooth posers.| What does that mean?
  It just means what it means. Hurry. Get the antidote so we can get outta here.| Thanks, LSP.
  Um... bumps.| Uh, yeah, bumps.
  Aw, man!| Hey, guys. Lookin' smooth!
  Really? You think we're smooth?| Well, mostly you in the center, but yeah!
  Why are you sucking up to us?| My best friend needs an antidote for lumpiness.
  Chyah, lumpiness suuucks. Hey, Monty, time's up, sphere-hog!  My turn! | So the antidote is in that orb you were sitting on!
  This orb is the antidote, bruh.| Can my friend borrow it?
  Yeah, sure, as long as you give it right back. | Hammacow. Thanks, fellas.
  What's taking so long? Did those smooth-heads give you the orb already, or what?| Wait!!
  Sorry, kid.  We changed our minds.| Why did you have to say all those rude things to them?!
  What? I was helping you.|  Thanks a lot!  They were right about to hand over the antidote!
   You're welcome a lot.| You insulted them! And they got mad! And now Jake's gonna be lumpy forever! THIS IS ALL YOUR FAULT!
  No. Because no matter how messed up and lumpy I get, this guy never turns his back on me!  Oh, yah. Right behind ya. Just gotta turn my back on this guy. | JAKE! IT'S ALMOST SUNSET!!  Jake... I didn't save him... I...  I'LL KILL YOU, LUMPY SPAAAAAACE!!
  Jam on, man!| Huh? I thought you guys left!
  We were drawn back by your plaintive wail. We dig your directionless fury.| Um, thanks.
  Respect. Here.  Take it. Win your girl back!| Yeah, there's no girl. But there is still time to save Jake! Do you guys know where Promcoming is?
  Promcoming takes place way down on that land-lump.| Awesome. Do any of y'all have wheels?
  Nah. We were all ditched here just like you.| Well... you think I can make it to that land-lump if I jumped off this cliff?
  You kidding?! A smoothie like you will plummet right into the eternal void!| What if I was lumpy? Could I float over?
  I'd say there's a 50/50 chance of you making it!| That's good enough for me. Now bite me!!
  That's good enough for me. Now bite me!!|  Yes! I can feel the multiple bites accelerating the lumpification process! I'm starting to float!
  Don't jump, guy!!| I have to! For my buddy.  RAAAAAAGH!!!!
  Wow. He's insane.| Ah, I made it! And there he is!
  Yeah! Promcoming! Yeah! Cool!| Jake! I'm mostly lumpy now! And I totally think you should sit on this sphere!
  No!| Sit on it!
   No!!| Please, Jake! You're my best friend! Just sit on the sphere!
  Chyah! I remember you! You're just a smoothie wannabe lumpy poser!| Sit on it!! Before I turn completely lumpy!!
  NO!!| Oh, no! I can feel the lumpiness... about to consume me!!  Oh, yah. Being lumpy's the best.
  Hey. Stop talkin' to yourself, dumb guy. Take your ball and get outta here.| Fine. I don't want you to have it anyway.
  So I can't have it now, eh?| That's right. It's mine.
  GIMME THAT BALL!!| NO! You can't have it!
  I want it! Give it to me!| You want it that bad? Go get it, then!
  Bumps, bi—   Oh, I'm not lumpy anymore! Oh, no. Finn buddy! You gotta sit on this!| No! You can't make me! Smooth—OOF! 
  Finn! Hey, Finn! Hey, buddy! Finn|  Huh?
  Hey, dude. We made it.| Man... There's something cold under my butt.  Oh!  The antidote! Just in time, too! LSP, I'm sorry I blew up at you before. I didn't mean it. I was just really stressed out.
  You know, it's fine. You and Jake can make it up to me by dancing this last dance with me.| Sounds good to me. Whaddaya say, Jake?
  Oh, no, our sled's broken! Hey, let's build one out of snow! | What are you doing, Jake?
  Sleds are for suckers. Just ride on my gut.| Okay! 
  Switch!|  Switch back! Switch back! 
   Switch back! Switch back! | Penguins!
  Penguins!| Ha Ha!
 Other| Aww, Ice King's here.
"  Yeah, I know what ""Ice King"" means"| Oh ho oh! Holy cow!
  Come on, brother! We're just trying to beat the heat.| Yeah! There's a big sleeping lava man in our front yard, and he is SOOOOOOOOOOOO hot!
  Mmm-hmm!|" Wait, wait, no, I take it back. I mean, not like ""sexy"" hot."
"  No, no, you do mean ""sexy"" hot."| No, I mean--
 Other|  Why don't you just try being cool.
  Uh oh.| 
 Other| Heh heh, yeah.
  Finn! Are you okay?| Huh, Wildberry Princess? Hot Dog Princess? W-what's goin' on?
  We're all prisoners, Finn.| Ice King!
 Other| Why are you keeping these girls prisoners, jerk?
 Other| Ice King, don't do this. Just let the girls go. They don't want to be here.
  Mm-hm.|  Don't worry, princesses. I pledge that Jake and I will protect each and everyone of you and furthermore I see all of you happily married to whatever sweet thing y'all want to be married to!
 Other|Rad! All I need is something to spear the Ice King with.  Binoculars... toothbrush...water bottle...rope...  sweater... trail mix... my flute! 
 Rad! All I need is something to spear the Ice King with.  Binoculars... toothbrush...water bottle...rope...  sweater... trail mix... my flute! | My flute!
  Aw, nuts, dude! You broke it when we tried picking the lock to that sad ogre's heart!| Darn it!
 Other| Jake!
   I... I'm okay.| Ice King! You better either set us free or come in here and fight me 'cause otherwise I'm gonna flip out!!!
 Other| ICE KING!!!...
  Finn!| Huh? Jake, you alright?
  I'm fine, buddy. Calm down and tend to the princesses.| Oh my gosh. I'm sorry, princesses. Slime Princess, are you alright?
  He's held us here for weeks, questioning us about our favorite sports and quirky behavior. I've tried to tell him as little as possible.| I understand. And, Lumpy Space Princess, how do you fair?
 Other| Leave her alone, Ice King!
  What are you thinking, Finn?| I've almost devised a plan. I'm gonna let him drum till' I've finalized the details in my mind.
 Other| Ah! It was fun! Hey, you should get some more fun stuff.
 Other|" ""Good idea,"" indeed."
 Other|" Alright. I've got a plan on how to get out of here. First everyone needs to be dancing and laughing and saying fun stuff like ""Whoopee""! Okay, when the Ice King comes back, everyone play it up, like we want him to come inside the jail and party with us and when he steps inside, I'm gonna beat the tar out of him with these...  ...while you all take care of Jake. Everyone on board with this?"
"  I think by everyone saying ""whoopee"" the plan won't work cause he'll know we're faking it."| Good point, Lumpy Space Princess.
 Other| We're having fun! Whoopee!
 Other|  He's not buying it. Dance harder.
  Come on in here and party.| Wanna dance with us, Ice King? Come on!
 Other| No! That is not the case! You're nuts, man! And I don't know how to help you! Probably because I'm just a simple dude. So maybe you should talk to someone with more life experience, like Jake!
  Whoa, whoa, whoa, Finn, what are you doing? Don't dump the Ice King on me!| But you gotta get it in you're head, man! Putting princesses in jail is wrong!
  Thank you, Finn.|  You're welcome, Slime Princess!
  And remember when you vowed to marry us to the thing of our choosing?| Yeah...
  Ooooh!|  Oh, heh heh, well how 'bout that... Jake, help me!
  Oh, gross! Put me down! Put me down!!!| Heh heh, I'm sorry. Jake! 
  Now, come on over! I baked y'all an apple pie.| Yeah, apple pie!
  Whooo-hoo-hoo!| I'm gonna eat it all before you even GET there! 
  Noooooo!| Apple pie!
  Shoo, fly! Get off my apple pie! Huh!  A fly landed on my pie. That's no good.  Bye-bye.| Why are you throwing the pie away?
  New pie?| Woohoo! Pie, yeah!
  Here you are.| Wow.
  Oh, Jake, thank you, but that ain't the best apple pie.| What are you talking about, Tree Trunks? What can be better than your apple pie?
  Finn, what would you do if you could do anything?| Anything? Well, I'd catch a shooting star, travel to outer space and fight space monsters!
  I'd carve my face on the moon so the moon would look like my face!| What would you do, Tree Trunks?
  I would go pick an apple.| ...Lame.
  ...Lame.| I'm sorry. I mean, it's just you pick apples every day.
  That sounds awesome!| Where is it?
  I've heard that it grows at the deepest end of the Evil Dark Forest.| Whoo! Tree Trunks you gotta go pick that apple!
  What? Me? Oh, no I'm just a cute little elephant. I'm not cut out for adventuring.| Tree Trunks! This is your dream! Think about eating that apple with your own mouth.
  Or your trunk.| Imagine the flavor.
  Really? You think I can handle the Scary Dark Forest?| Yeah, and we'll help you.
  Psst, I can take you even higher on my shoulders.| No, Jake. She has a weak heart.
  Oh, yeah.| Ewww, why is this ground all squishy?
  I wanna try!| Okay. I'm cool with you letting you do whatever you want.
  Oh, hello there.| Uhh, Tree Trunks, stay away from that.
  Uhh, Tree Trunks, stay away from that.| Ugh, you're gonna get it, wall of flesh.
  An eye and a mouth. Well, I think I got the perfect thing for him or her... stickers!| Careful, Tree Trunks, this thing is evil.
  Oh, now, whatcha doing?| Huh? Tree Trunks!
  Whoo!| You better stay in that tree, baby. Um, Tree Trunks were you putting stickers on that evil monster?
  Yes, I thought it needed some tender love and affection. Oh, what a pretty butterfly!| Tree Trunks? Ugh. Jake, I just realized that Tree Trunks is old and bonkers. We can't take her through this Evil Dark Forest.
  Nah, she'll be fine.| But the monsters?
  It's fine. It's fine!| Are you sure? 'Cause she has zero adventurer training.
  Yeah, yeah, yeah, yeah, yeah, it's fine, she'll be fine, it's fine, it's fine, it's fine.|  Maybe it is fine. Tree Trunks?
  Where'd she go?| Tree Trunks!
  Tree Trunks!| We gotta find her, Jake! Tree Trunks!
  And here's your sandwich. Oops, you dropped it.| Tree Trunks, run!
  Hiya!| Time to call your mamas, evil sign posts.
  Patience, boys. There's enough tea for everyone.| Errr...
  Oh, Finn. What a nice hug.| I'm not hugging you! I'm trying to save your life! There's too many!!
  Oh, Finn. That tea party was crummier than a big old biscuit.| Errrr. Tree Trunks, I'm all jacked up because of you. Look at my jacked up face!
  Are you mad at me?| No, I'm not mad. You're too super-cute for me to be mad at you, and you're a top notch adventurer. Now, let's go find and eat the heck out of that crystal gem apple together.
  No, I'm not mad. You're too super-cute for me to be mad at you, and you're a top notch adventurer. Now, let's go find and eat the heck out of that crystal gem apple together.| Dang it!
  You go fight—I'll keep Tree Trunks out of trouble.| Awesome.
  I'm helping you by tempting this guy with my body.| It's not a guy, Tree Trunks! It's a Snake Armed Ruby Brain Beast!
  Even brain beasts get lonely, Finn!| Jake! You were supposed to watch her!
  She got passed me, man. I tried to stop her, but she overpowered me.| GET her out of here!
  Finn, kill it!| I can't find it's magic gem weak spot!
  I can't find it's magic gem weak spot!| Oh, there it is.
  I did it! I helped! I'm the sexiest adventurer in the world!| Tree Trunks!! You're not an adventurer! You nearly got yourself killed again! Do you wanna die, Tree Trunks?! Is that what you think adventurers do?! Die and make all their friends feel terrible 'cause they couldn't save them?!
  I'm going home now.| Ugh... Tree Trunks. Tree Trunks!
  Don't follow me. Oh, Finn... You shouldn't yell at cuties that just wanna help you. OH!| Man, I feel horrible. I was only yelling because I care about her safety.
  Finn, I found the crystal gem apple.| Woohoo!
  You're the man, Tree Trunks!| Tree Trunks, I'm a huge butt guy for getting mad at you. I'm a huge fart. I was only upset because... I love you and I don't wanna see you get hurt.
  That's precious, Finn, and I'll accept your apology if you let me kiss your cheek.| Uhhhh, I don't know, I--
  Uhhhh, I don't know...| A crystal guardian! Tree Trunks, stay out of the monster battle this time. I don't want you getting hurt.
  Alright, I promise I will.| Radical! Back off you!
  Back off you!| Stop copying me! Grrah!
  Stop copying me! Grrah!| Ahhhh! A-a-oww..
  Ow! Ow.| He's copying everything we do.
  Whoo! Shake it, Tree Trunks!| Gem-clam! Let's beat it up while it's copying Tree Trunks! Yaah!
  Crud, this is barf dude.| Oh, man, I'm a total moron! We gotta fight this one Tree Trunks style.
  I'll get the make up.| Hey! Crystal Guardian, are you okay with Tree Trunks taking a bite of that apple?
  Okay!| Whoo! How's it taste, Tree Trunks?
  Please! Calm yourselves, my people. I am safe! Oh, thank you, Finn. You truly are my hero this day.| Cool.
   Hero... Hmmm... Heeeeerroooo... Hey, I just thought of something!| Uhh... What'd you think of?
   Math. Hurry, Finn!|  No way!
   Here it is. Check it out.| A magical globe?
  No, Finn. It's what you can see through the globe.| Golly!
   Look. See this book?| Yeah, I see it!
  It's called the Enchiridion. It's a book meant only for heroes whose hearts are righteous.| Shmow-zow!
  The book lies at the top of Mount Cragdor, guarded by a manly minotaur. It's waiting for a truly righteous hero to claim it!| Do you think I've got the goods, Bubblegum? 'Cause I am in to this stuff!
  Yeah, I know. And yes, I do.| Then off I go!
  Then off I go!| Jaaaaaaaaake!
  Jaaaaaaaaake!| Thanks, pal.
   Farewell, Fi—Oh, wait a minute...  Farewell, Finn the human boy!| Bye, Princess!  You know what time it is, buddy?
  Aaaaadventure time?| Yeah, man!
  Oh ho! You've unlocked the riddle of the door.  Brilliantly done, child! Please, reveal to me how you unraveled my clue.| I just thought you'd look cute stuffed in that lock.
  Oh, yes. That's how most people get in.| Bye!
   Enchiridion is...  That way.| What?! Dude! You can't smell the book from here!
  It's in the castle on top of the mountain.  In a room.  Wish you had one, huh?|  This way!
  What about the book?| It can wait. Someone needs our help.
  Yo, Finn. Are you alright? Did you get brain damage?| I'm fine! Keep going! We have to hurry!
  I'm fine! Keep going! We have to hurry!| I gotcha.
  La la la-la!| What?!
"  Every time you say ""what"" we'll destroy an old lady."|  What?!
"  Every time you say ""no"" we'll destroy an old lady."|  No! Wai...
   No! Wai...| Please...
  Please...| Don't destroy...
  Don't destroy...| Anymore...
  Anymore...| Old women.
  Hey, Finn. You okay?| No way, dude. Those old ladies are destroyed because of me. I'm not righteous. I'm wrongteous. Stupidteous.
  Awww. Don't let those gnomes and their illusions get you down. They're just gnomes and illusions.| Illusions?
  Yeah, man. Think. What would regular, old, sweet ladies be doing wandering the hills of Mount Cragdor?| Maybe they're lost?
   No way. This place is designed to mess you up. To mess with your head. None of this is real. It's all just trials to test your heroic attributes.| Hmmm... Hmmm!
  Now let's go get that book.| Yeah! You're the smartest dog I know, man.
  Yeah! You're the smartest dog I know, man.| Jake? Jaaaaaaaake!
  You cannot pass!| Gimme back my friend!
   It's ok, Finn! I can get out!| Let Jake go, or I'll...  I'll kick your foot!
   Don't worry, dude! I found another way—oof!| Huh?  I'm coming, buddy!
   I think your dog finally fell into my stomach. Hey... Where'd you go?|  I got your wallet, man!
  No! My big money! Give it back!| Give me back my friend!
  But I killed him already!|  Fine.  I'll give you your dollar.  Here's your dollaaaaaarrrrr!
  Whoa. Whoa. Whoa. Whoa-oa!|  Jake!  You're okay!
   You're under arrest for stealing my dollar! | Just a minute, Jake.
  You know what that was? That was righteous.| Thanks, Jake. Now sniff out that book for me.
  Congratulations, Finn the human. You must be truly righteous to have made it this far.| Thank you.
  Now! Enter my brain-world, and I will show you some aspect of yourself that you're not entirely aware of.| Where... am I?
   For your final trial, slay the beast!| Why? Is it an evil beast?
  Yeeeeessss. It's completely evil. Will you slay it?| Shoot, yeah. I'll slay anything that's evil. That's my deal.
  Yeeeeessss! You've done well, hero.| Thank you.
  Now! As one last, last trial... Slay this ant!| Is it evil?
  No! But it's not good either. It's, uh, neutral. Will you slay it?|  No!
  If you want the heroes' Enchiridion, then slay this unaligned ant!| Never. Never. Never!
   Congratulations, Finn the human. Now you have truly reached...| Never!
