input|output
  I don't real-talk with my food.| Uhh...  We real-talk now, or you're going to be as single as your stinky web squirter!
  Yeah, right. You just wanna get out of my web. All you ever want to do is escape! You're always, like, in cahoots, makin' plans not to be food.| I'm not in cahoots!
  So okay, eat your friend here. |  Okay.
  No, man! What?! Where's your heart?! Look inside yourself! This isn't you!|  I'm gonna fake eat you, man.
   Okay, man, you've earned my trust. So, let's do this. Real-talk me, bro! |  Okay, first off, then, how you're going about this isn't working. Am I right?
  Ugh, yeah. It's not working. My way sucks.|  Cool, now we've gotta do damage control. Healing the negs energy at the source.
  Yes, heal the neg-jerseys in me.|  Alright, uhh...
   Alright, uhh...|  Go find Barb a present. That'll fix the first neg. Can you do that?
  Whee!| You're free!  Aw, man.
  It's okay, Finn. You bought us some time.| Yeah, think fast, what can we use?
  There's nothing! Just a bunch of nature.| I have a dumb idea.
  Yo what?| Shoot!
  My eyes! Agh!! | Ha ha, yes! Finally! 
  Good job! Last chance for life. Break out!|  Yeah, you mommy!
  Hey, what's going on here! | Nothing.  Oh, crab apples!
  Where's Ed?|" Oh, uh, he's getting you an ""I'm sorry"" gift."
   I'm gonna eat you!| Yo, that's wrong!
  Oh, no. You got that look on your face. You going back to help that fool?| His wife's gonna eat him!
  You little twerp! Are you stupid or something?| Yeah, I'm stupid. But I know something real. You shouldn't eat your husband!
   Yo, smoothin' things out?| Not exactly...
   Barb! Barb! What's wrong, my love?  Okay ...| What is happening!?
  Oh, Ed. We're parents!| Aw, sick!
  Nice.| Think they're gonna make it?
  Oh man! Alright, what's next?| Haha, let's see...  First we visit Tree Trunks for apple pie, and then we go to Bubblegum's science music thing!
  Wait, what about the movie at the drive-in?| That's after we make dream sandwiches!
  Whoo!  Let's go, apple pie!|  Whoo!
   Whoo!|  Tree Trunks!
  TT!| Tree Trunks!
  Hmmm.| Cool.
  Oh, you.| Where's the apple pie, Tree Trunks?
   I love her so much.| WHOA! You love 'er?!
  Whaa? No!|  You just said you love 'er.
   I think I am in love with her! But I don't know how to go about it... | Dude, you should just tell her how you feel!
   Where is she? | You givin' me a back rub, bro?
  Huh? Oh, gross!| Hyeah! Break it up, break it up! Okay, the love show is over! Princess, please continue.
  Why's everybody givin' me the hairy eyeball?| Y'all are too affectionate. It makes people feel... bothered when you and the Pig your affection in public!
  They don't want us to flaunt what we have?| You two need to hide your love... or else, you'll end up making the whole world throw up!
  We promise to keep our affection hidden.| Thank you.
  Have you seen my other shoe?| I think I saw it in the closet!
   You shouldn'ta bought so many flavors! I had to make a sandwich for each flavor, and for each flavor combination!| I'm makin' a cheese sandwich!  Tree Trunks! Pig! Come on!
   Try harder!|  Doesn't look like Tree Trunks and Pig are around!
  Aw, man!|  Just try to ignore it and watch the movie!
  Stoooooop!| Tree Trunks, this has gone on long enough! No more spending time with the Pig, unless you do it, inside your own home.
  But Finn, an unmarried couple living together one roof, that's indecent!| Then, why don't you two just get married?
  -we need time to get to know each other.| Then I guess we only have one option.
  Then I guess we only have one option.| Alright. 
  Little dove!|  Sorry, Tree Trunks.
  I don't know what I'm going to do without him, Finn!| Why don't you make apple pie to take your mind off of it?
   I close my eyes, and feel his arms around me, in my dreams... he's not so far away.|  Go to him.
  I'm freaking out!!| You know what? I like it. It's nice.
 |Oh. Heh heh. What? Where are we?
 I dunno.|What did we do last night?
 Mayhaps we drank juice of the Elder Toad.|Eh, I doubt it. Yo, do you see this? We're in a cage! Do you think we, like, did something wrong?
 Yeah, right. When did we ever did wrong actions? Get real. |Who ya calling?
 I'm callin' BMO, see if he knows what happened.  Junk... My new camera phone... Wait, c'mere!|What?
 I guess I vid-taped a buttload of stuff on here.|Play it for the clues within.
 Alright, let's do—|Oh, no! What?!
 Battery crunked out.|Dude, do you remember any of that mess?
 No, but I guess we're here on purpose?|So we opened a portal to somewhere, but where? 
 You're in the Nightosphere.|Are you sure?
 Look!|
 |Marceline's dad! We really are in the Nightosphere!
 Up an' at em, people.  Eveyone out of your cages. My shift is over, and no one's shown up, so...|Whoa, wait. You're letting us go?
 I mean... yeah, but not really. You're in the nightosphere, so...|So what?
 |Hey, c'mon! Just tell us how we can get back to our world.
 Hunson Abadeer?  Alright.|Well, dude, how do we talk to him?
 You can't just talk to the boss. You gotta make an appointment.|Yeah, but we don't even know why we're here!
  Hey! Hey! Is there an outlet anywhere? You guys...|Maybe this is where they put all the dummy demons.  Right, big guy? You're not so smart, right? Yeah...  Let's go out that hole, man.
 Okay, get on.|Mm-hm, mm-hm. Pretty neat.
 Mm-hm, mm-hm. Pretty neat.|Whoa, look!
 Daddy!|What is that?
 I think it's like sentient blood mist.|Cool.
 C'mon, let's see if anyone knows where Hunson Abadeer is.|Alright, well, how about that dude? 
 Okay.| Yo, bros! How do we talk to Hunson Abadeer?
  The teller can help you. Get in my flipping belly, and I will transport you. My insides are habitable. You will not be digested.|Bye, mister!  Who's the teller? That guy? 
 I can't, dude. This outbox is packed tighter than my tummy tunnel when I can't make brown on the camping trips because of my anxieties and I have IBS also.  Ow!|Hey, guy, are you the teller?
 No, no, no, this is the line to meet the teller.|No, man, are you for real? How long's the wait?!
 I dunno. I just like to row around on top of their heads.|Bunk that!
 I... ew, no.  Sick.|Why do we need to see the teller anyway? We just wanna see Hunson Abadeer and find out what happened to us!
 Youse ain't special! Youse gotta wait just like the rest of youse...  Us.| Where's the line start?
  That guy stinks.| Excuse me! Excuse me! Big man? Over here!
 Huh? What, me?|Uh, yeah, how long have you been in line for?
 How... long? |Oh, butt traps. Jake, stretch us to the front.
 I will kill you with all my hopes and regrets!|All right, dudes, chill! We'll wait! 
 I... can't. I got nothing to say anymore.|Just make up words then!
 Woohoo!| Yo, yo! We wanna talk to Abadeer!
 Wha... Huh?  When your thingy comes up, Hunson Abadeer will see you through the door.| 42 million?! What's the number on the door?
 41 million...  We're next! Whew! Man, I thought I was gonna throw up!|That's us!
 Yaaay!  Nooooooo!|I'm gonna lose it! Waaaaaaaaaaahhh... 
 What's going on, buddy? You givin' up?| I guess.
 You don't wanna just stick it out a little more?|I don't know if my little boy heart can take it.
 Listen, Finn. Are you listening?|Mm-hmm.
 Your heart may be small, but it's strong as a bull donk. And I know. You can wait through this line so we can meet Hunson Abadeer and find out why we're here, and why we're in a pile of banianials, 'cause you're a champ, OK?| Ok.
" 上手で頑張ってね (""Being that you are skilled you can do it!"")"|Well, at least I can see the end of the line, I think. Let's wait the heck out of this line!
 That's it, champ.  Hehehehe, you're pretty pumped up.|I'm super pumped!
  Put your hand down, Finn!|No way, dude, I got questions.
 No way, dude, I got questions.|What the hey, Jake!
 It's not answering questions, man. That thing is gonna bake our beans.| Hey, bloodmist cloud! What happened to us? Why can't we remember any—? Oh, it's gone.
 Ride me, partner. |Hey, cloud! Where's Abadeer? Whoa, look at all these paintings. I think this is Hunson Abadeer's house.
 Hey!|Hunson Abadeer!
 We just wanna go home, man.|Yeah, why'd you lock us up, Abadeer? When Marceline finds out about this, it's gonna stir up some heavy daddy-daughter issues.
 Finn!|Oh, my lob, Jake! You found the portal!
 |What the—?
 I'm gonna close this portal.  You're forbidden to come back to the Nightosphere!|But Marcy, let us help you!
 It's too late! Stay away from me, FOREVVVEEERRRR!!!! |Marceline's in trouble! We gotta go back and save her.
  Yo yo yo yo, check it! This is Jake on my camera phone!  Whooooooooooaaaaaaa. Whoooa! Yo, Finn! Say 'hi' to my new camera phone!| Whaddup camera phone!
  You guys wanna come party in the Nightosphere with me? I'm visiting with my dad and it's craaaazy boring.| Whoa, wait a minute Marceline. Last time I saw your dad,  I sliced open his soul sack. 
  Oh no, he's totally chill now.| Okay, but I'm keepin' an eye out for your old man in case he pulls any  sneak attacks.
  There you are, Marceline.  Huh?  Oh. Hello, dog. Hello, Finn. | Stay away from me, old man! 
   Look, let's play something, okay?| Okay!
"   I know you just wanna give your little girl the world, but Daddy I'm not just your little girl. I've got my own life, I've got my own plans, I hope you understand and like the way that I am because I want your respect and I want to be here. But I don't wanna rule the Nightosphere.  Psssh. Whatever, Dad. [Puts the amulet on. A suit comes out of it and wraps itself around her. The phone is dropped and tentacles are seen. The phone is picked up and Marceline is seen looking like her father's monster's form in ""It Came from the Nightosphere."" The camera zooms out to show Finn approaching Marceline while she laughs evilly."| Jake, grab the amulet! 
  Well... that explains how we got amnesia-ed.  But what about banana?| Hey man, there's another video!
  We got mad prison overcrowding down here, fellas.  So I gotta put you in the cage with the stuff. Sorry about that. But, you know, not really.  Aw, my stomach! | That amulet's controlling Marceline! We have to go back and help her!  We're gonna get back using that one portal spell we know!  Maloso vobiscum et cum spiritum! 
   Whoa, dude!  She told us never to come back!| Oh yeah. Oh!  Jake! Can you turn into a gross demon?
  Mhmm. | Grosser!
   What's your disguise?|  Paper plate mask, yo!
  Nice!| Let's go! 
  Yeah, gimme abs! | I think we can charge up there and rip the amulet off her neck. 
"  Hey! What're you guys doin'?! You can't run up to the front of the line! These good people have been waiting forever! Shame on you both! Everybody, shame them!  Boo, sir! I ""boo"" what you're doing! Step back!  Back!  You will not cut the line!  Again!  You stay back here! And wait your turn like the rest of us!  Under... stand?!"| Yeah, okay, okay!
  Who are you?| Ahh! Don't kill us Marceline!
  It's us! Finn and Jake!|  Your friends, remember?
  Oh Grod!| Run!  Marceline...
  Run!  Marceline...| What are you doing?
  Just grabbing a midnight snack. | It's Marceline! That's her out there!
  I know!  Isn't it fantastic?|  No! We have to save 'er!
   Save her?| From the amulet!
  But this is what I've always wanted! My girl, following in her daddy's footsteps.| But that's not what she wants!
  That's balderdash, baby. The wearer of the amulet is filled with chaotic evil! Which is how I grew up. So... | Maybe we can get these dudes to help us! 
  These guys won't help you. They're all complacent sheeple. | Wait, that's it! We're gonna freestyle a political rap to get these guys to rise out of their systemized demon apathy.
  The system is broke, yo!| Marceline! 
  Aw, sick!|  Jake! The tree house!
  Ahhhh! I'm too freaked out to move, Finn! These demons are nibbling my legs! |  Jake! Take her! 
  No, Finn! You'll be filled with chaotic evil!| Marceline...  No one...  leaves the Nightosphere!
  You gonna do the thing again?!| Yeah, man!
  Yeah, man!| Whaaaat?
  Nice.| Hey, Princess Bubblegum. Hey, everybody.
   Man...  Dancin' is rough!| Yeah... I'm havin' some sweat issues here! I'll go get us some snackety-juice.
  Hey, man. I'm Jake.  I'm Jake.  Hmmmm...| Check it out, Jake! I got us some peanuts. And punch! 
  Check it out, Jake! I got us some peanuts. And punch! |  Choking!! Don't give up on me, man!
  Whoa, Finn, nice book.|  Yeah. 'S pretty cool. It's the Enchiridion—the hero's handbook.  Hey, guy, you alright?  Haha. He's all good! Everybody get back to your dancin'!
  Uh, Finn? I think that bear is followin' us home.| Whoa. Haha. I think you're right. Hey, bear, you gonna come hang out with us?  Whaddaya say, bear?  Heh-heh. Awesome.
  I dunno, Finn. This guy seems kinda weird.| Yeah. He's totally weird. Hahaha! 
   Mmmmm...| Jake! Hey, Jake!  Jake!
  Jake| Come here! Ya gotta check this out!
  Eh, okay.| Check this out, man. This bear is tops blooby!  Watch this.  Ya gotta try this, Jake. He does everything I do!
   Oh, stop! | Haha, come on, Jake, try it!
  Heh-heh. Um... Yeah, okay.  Sweepy-sweepy-sweepy. Sweep sweep sweep. Sweepin'!|  He's got me down pat! Heh-hah! Sweeping's weak.
  Sweeping weak.| Whoa! This guy's alright!
  This guy just busted me up my chops, Finn!| Hey, come on, he's just a bear. He don't know nothin'.
  Mmmm... Yeah, I guess. Well, anyway, it's gettin' pretty late. Probably time for everyone to go back home to their own houses.| Yeah, I guess you're right, Jake. It is pretty late. He should probably stay here tonight.   You can sleep in the bathtub!
  Braaaathtrub. Sleep in.|  Brathtrub, hahaha! This guy's tops blooby!
   Whaaaat? Hey, Princess Bubblegum. Hey, everybody.  Whaaaat? Hey!  Hey, Princess Bubblegum! Hey, everybody!  Whaaaat? Hey!| What are you doing?!
  Shhh. Come with me. Ya gotta see somethin'. This bear's wiggy, Finn. It's wearing your clothes and dancin' around all crazy.| That sounds rad, man.
  Aw, man!  Oh, ya gotta believe me, Finn. I swear, he was, like, all wigged-out, was dancin'... | ...I do believe you.
   Oh.| It's just, y'know, who cares? Dancing, wearing clothes... He ain't hurtin' nobody. He's just doin' it up, y'know? He's just cool, and he likes my style. That ain't a crime.
  No.  I guess not.| Okay. Great. I'm going back to bed. You comin', smart guy?
  | Anyway, I gotta go pick up BMO from soccer. I'll be back soon. And remember
  Uh, nope. The bear did it, and I've got proof. I taped the whole thing.|  The bear ate all my cakes, and you just sat there and watched him do it?! What's wrong with you?!
  Ju— What?! No, man, he was tryin' to frame me, Finn! He's tryin' to steal your identity! Why can't you grok that?!|  He's a bear, Jake! He's a wild animal! He doesn't know things! He just does stuff! He's cool!
  Ohh, fine, then that's just great. Then you and M.C. Cool Friend can go stink it up together at your stupid cool Finn party all by yourself, cause I'm not going!| ...Wait. What? What party?
  What? Your party, man. Tonight? In the woods?|"  ""Finn'z... bezt... party?"" But... I didn't make this flyer."
  See, dude? He's not just jackin' your style. He's jackin' your whole you! Jackin' yo you up!| What the what?
   Sure! I'll have another...   ...peanut.| She's not my...  We never went steady.
  Troops brooby! Troops brooby. Troops— | Not cool, man.  You're not me. You're just a bear acting like me.   It's okay, everyone. The imposter is gone.
 Finn... nobody really thought the bear was you.|  Wait... what?
  We just thought it was one of your jokey-joke-jokes. | Hey! Hey, bear!
  Wait up, guy!| Hey. I... I didn't mean to make you feel so bad about yourself. I'm really sorry about that.
  Me, too.| But... you're a super-rad bear, so... why not just be you?
   I... want... be... hero... like... yooouuuu!|  Awww...
  I guess he's got a heart of gold after all.| Hold on, bear. I got something for ya. It's the Enchiridion, the hero's handbook. Everything you need to know about being a hero is in this book. Take it, and learn.
   Finn, are you nuts?! We can't give that book away! It's, like, crazy-important!| Whatever, man. We never use it, except for, like, sitting on it when the grass is wet and stuff.  Drink your fill of knowledge. Someday, you'll be a great hero.
  The Tree of Blight.| Every hundred years, it spews evil spores across the land.
  Huuugs!| What the—?! Is this an extra butt?!  Quick, Jake! Burn the tree!
  Dude! The tree's about to 'splode its evil juice all over!| No!  Jake, hurry!
  Is he crushin' you, man?!|  No, he's just... hugging me gently!
  Hey, buddy, you okay?| Didn't even tell me its name...
  Wha..,?|  Oh, sweet! Ha-ha-ha!
  Hmmmm... Dude, why're you so huggy?| I just feel affectionate, I guess. Hugging helps.
  Hmm...  You've got a fever, man.| I feel hot. 
  You feelin' better today?| Yeah. I feel like a million clams.
  Huh? Not again!| What's the matter, Cinnamon Bun?
  Please, Finn. If you're gonna hug me again, don't make it as hard as you hugged me last night.| Uh... I didn't hug you last night.
  Yes, you did! My love handles still hurt! You came into my room around midnight and gave me a squeeze—a really strong one! | CB says I hugged 'im. Haha. Cinnamon Bun, you got some crazy notions. I tell ya.  Oh, Cinnamon Bun.   What a crazy story, buddy.
  Yeah, buddy, but you were pretty huggy last night... buddy.| Wait. You don't think I actually snuck into Cinnamon Bun's room and hugged him, do you?
  I'm just sayin' you were really clingy.|   But no. Why would I? And don't tell me it's because I have repressed emotional feelings for Cinnamon Bun.
  Your questionable behavior started about an hour or so after you got hugged by that wolf man, right?| ...So...?
"  Well, I've been thinkin' that maybe that wolf man wasn't what he seemed. Maybe he was some sort of hug wolf. Yeah, here it is.  ""Hug wolves—a subset of wolf men which roam the countryside with a fervid hug lust. Every night, hug wolves must go out and hug people to satisfy their insatiable craving for hugs. To become a hug wolf, one must be hugged by an alpha hug wolf on the night of a full moon.""!"| Like last night!
  Yes. So you must be a beta hug wolf. A lower-level creature.| Well, how can I get uncursed?
  Lemme, um... read the book a little more. Says there's no known cure.| Uh... I'm scared, Jake... 
  No hugs!!| I'm sorry!  I feel hot! Rrrrr!!
  Hmm. Well, that plant's not gonna protect you.  You can get this under control, buddy. ARE YOU READY TO OVERCOME THIS THING??| I think so.
  I said... ARE YOU READY TO OVERCOME THIS THING??| Yeah. I heard you. I said I think so.
  I'm tryin'a' getcha to shout.| Oh. Okay. IS THIS GOOD?!?
  Never mind. Now. I want you to think about hugging a cactus. How would that feel?| Prickly and painful.
  Good, good, you're doin' great!| Cool. So, can I hug the cactus now?
  No, you can't hug anything.| But that poor cactus! It... it... NEEDS ME! 
  Oh, no, the hug lust is already takin' over your brain!|  I want to hug you, Jake! Close!
  Finn... say something to reassure me.| I'LL HUG YOUR MOM!
  Jake! We need the silver baseball!| Hrrugs!! HUGS FOR BUDDIES! 
  Oh, Glob! Oh, my Glob, Jake! Mama!| Bring it in, guys!
  BMO! Strobe light mode! | Not cool!
  Back, beast!| Hug wolf, away!
  Surely this frosted drink will soothe my fevered tempers.  Hellooo? Good heavens! A lycanthrope! AAAAH!!|  Hug you up, bro! 
  Dracula? AAAAH!! Eeee!!|  HUUUUGS!!
  There he is!| Huh? Huh?  What... What happened? Jake... what happened to me last night?
  You hugged... everyone.| NO!
  We're mad, but we're not gonna go down there.| People of the Candy Kingdom, all I've ever wanted was to keep you all safe, ...and because I can't undo the hugs I've caused, my sole wish is to be locked up forever in the Candy Dungeon.
  Uh...| Huh?  HUUUGS!! 
  I-I-I-I'm not supposed to.| Don't you want a hug?
  I can't, man!| Not even a little one?
  Uuuuhhh...| You want a hug?
  I'm gonna hug you up.| You call that a hug?
  Yeah... You stopped, too.| I just... didn't feel like I needed any more hugs.
   Can I get a hug?|  JAKE!!!!!
 Oh, my gosh! How many times do I have to tell you? Somebody broke into my house and stole my lumps!| Peebo?
  Eeeeeugh...| Eh...okay, calm down...
  Haha, gross.| Whoa! Gals... we'll find this crazy freak and return all of your body parts!
  Thank you so much, Finn!  I should give you a kiss!| It's... it's okay, Hot Dog Princess! We'll be right back.
 Other| Ice King, we know you did it!
  Lady don't take my pizza....| What's h— Oww... 
  What's h— Oww... | A mo-mo-mons-mo.....
 Other| Hey, Ice King!
  Ouch.| Do you give up?!
  Finally... let's get those princess parts back to the ladies.| Yeah, mans. Wait... where'd your wife go?
  Yeah, mans. Wait... where'd your wife go?| Huh?
  What'ya building?| Um, it's just a little stick fort.
   Hey, get away from my fort, you big stinky monster!| I like it when you get small, Jake.
  Whoa, whoa!|  Whoa, Peppermint Butler!
  Hi, Finn. Hi, Jake.| Hi, Goliad.
   Hi, Finn.| What did you use to make her?
  I still need to fill them with knowledge...  about how to rule a kingdom. | What? Let us teach her.
  Woow, woow, woow!| C'mon, Goliad.
  C'mon, Goliad.|  See ya later, Princess! Get some sleep!
  Huh? Whu...? Bye guys...| Look, Goliad. This is a preschool. I'm gonna set up some obstacles and all that for you to learn on, is that okay? 
  Yeah, thanks Finn. I'm excited to learn.| Okay, great. Jake, you go and get some kids from inside to help with the lesson and such.
  Wow, holy shmow!| Oh, hey, y'all are just in time. You ready to pop this croc's back Dr. Goliad?
  Uh, you know, Finn... maybe this isn't such a good idea, actually.| Oh, no, it's cool. I got helmets for everybody.
  Oh, no, it's cool. I got helmets for everybody.| Okay, Goliad, you ready to lead? 
  Ready!| Okay, in 3, 2, 1...  Go!
  You're gonna mess up Goliad! I'm Don Juan Cherry Temp—  Cherry Tempo! It's my way or the highway, Glob-globbit!| Stop stop! No, Goliad, no! Leading isn't about scaring people, you gotta stay calm and use your head. Use that beautiful brain, girlfriend.
  My brain? Are you sure?| Yeah! Don't be shy. Try it on me, lead me.
   No, Goliad, that's wrong, too.| You can't just control people or whatever, it's messed up.
  No, Finn. This way is good. Everyone did what I wanted. Really fast, no mistakes, calm like you said. This is definitely is the way to lead. Definitely.| Um, no, no. ...Wait, is that true? 
  Goliad's got mind control powers!| She got the wrong idea about leadership!
  No, Princess.   This is my castle now.| Don't worry, Princess. We'll stop her!
   Ugh, eyeball... Just tuck that eyeball back in its hole.| Goliad, no!
  Goliad, no!|  Jake, don't swallow!
   Jake, don't swallow!| Uhh, you're in Finn's bubble.
  Uhh, you're in Finn's bubble.|  Don't think of the plan... Think of something else. Think of something else.
  Finn, are you okay?| Yeah, that dude saved me.
  That's Stormo, Goliad's new brother.| Wha-- What are they doing now?
  Wow, man, so, like... I guess they're so evenly matched that it's a stale—  It's a stale— | They're so evenly matched that it's a stalemate!
  Yes. Stormo sacrificed himself to keep Goliad in check for all eternity.| Well, that's pretty cool, but... I don't understand. If Goliad and Stormo are the same, how come Stormo is a good guy?
  Oh, that's simple| Oh, whoa so, that means Stormo is like... my son?
  Well, yeah... in a way.| Happy birthday, Stormo.
  Man... let's go home.| Nuts to that. I wanna find a mystery cave.
   But, Finn, I'm gettin' all cranky around my joke-hole.| Ow!
  Oof!| Ooh-la-la.
  Whuzzat?| Mystery cave! C'mon, Jake!  Oh, my glory...
  Dude, no!! Don't touch that thing! It's probably got some kind of sacred significance.| Yeah. I want it for my sacred bathroom.
  Finn?!  Oh, my Jah! Finn's become one with the lamb!!| Jake!! You see this crazy jazz?!
  Wish I knew how to free you, bro.| Me, too, bro.
  But Finn always loved BMO farting. | Heh heh heh heh heh!
  Okay!| What? Nooo...  No! Not this song!!
  Are you hearing this, buddy?| Guys... I haven't liked this song since I was two.  Cut it OUT! 
 Other|  It's just a dumb old leaf, ya dumb old Ice King.
 Other| Wait! What?! Ice King! You can hear me?
 Other| No, it's just no one else can see me or hear me talk.
 Other| Man... Never thought I'd be happy to talk to you, Ice King. Can ya help me get free??
 Other| Anyways... Where do all these spirits come from?
 Other| Sick.
 Other| Cool.
 Other| And doing that will set me back to normal??
 Other|  So be it!
  Alright, Finn. This oughta free you from your body prison. Couple-a' rounds of Kompy's Kastle will jog your psychic schnaps. That's what I think. Co-op mode like we always do! Oh, yeah! C'mon, Finn, drop the drawbridge. Kompy's blood lust meter's goin' down. Lemme help ya there.  Whuzza!! You love Kompy! | I... did it.  I did it. I'm ready, Ice King. Make me normal now.
 Other|  Ew! Ew! Ew!  Eeeewwww!! 
 Other| So... now I can go back to normal.
 Other| ...What?
  Wanwan!| What is that?
 Other| What do I do? Follow the heads?
 Other|  Alright, man, I'll get it.  Where's your daddy, huh? Is he hiding in there?
  Wanwan.| You better get back in the Spirit Hole, dead one.  Okay... 
   Wamwanwan.| Oh, my what? The cave?? How the...??? ...Weird. That's weird, but whatevs, though.  Whatevs. Ice King! Ice Kiiiing!  Where'd you go, Simon?  Ice King?  Dude, come on, what?
 Other|  I'm gonna re-open the hole.
 Other| Great. Now we're both stuck in here.
 Other| STOP! WUUH!
 Other| Ah, jeez, come on!
 Other| Whoa, do that again.  Your hand is affecting the TV! We must have some kinda subtle effect on the material plane!
 Other| It's okay! But let's use our subtle influence to break the lamb!
 Other| Yeah, man! Bwoooo!  It's workin', man! Combine the swirls!
  Whoa! Finn, is that you?!|  YES!!
  Finn! Finn! Finn!  Whooooaaaa...  That was beautiful!| Heh-heh.
