input|output
   Our lives have improved since you came here.| Does that mean you're going to release me?
  Your cage is made of sticks, brother. Just kick it apart.| Cool!  Yeah! I'm coming for you, Jake... with a story!!!
  And then what happened? | And then everyone in the forest was happy... The end.
  Huuuuuuuuh!!!| What's wrong?!
  That was...  perfect! I feel a million times better!| Really?
  Yeah! The romance stopped my fever... the suspense cured my headache... and everything else cured everything else! I'm not sick, I'm not sick!| Ha ha! Neat. 
   Finn, c'mon! Dance the health dance with me.| Nah, I'm good. 
  You allergic to my health dance?|  No, I just feel bad.
  Ohhhh... Finn, did you catch my sick?| 
  Hey, dude, can I borrow that paper?| Mm-hmm.
  | Oh, sick!
  Ugh!| Dude, how do you fight a snail?!
  Salt?! But I heard you guys were heroes.| We are heroes. We thought you were trying to attack us. Why'd you break in here all mad, squirting that juice all over us?
  It's not mad juice. It's sad juice. My name's Snorlock, and I'm sa-a-a-a-d! | Stop squirting slime! Just tell us what's wrong!
  I need a girlfriend. I have no one to love.| Jake, hero huddle.  What do you think?
  I think our house is all jacked up.| Yeah, but he's just an innocent goober looking for love.
  Yeah. Okay, let's help him. But he's got to lay off the house.| Right! All right, man. We'll help you hook up as long as you—
   You guys... won't help me? | All right! all right! We'll help you, dude! Just put our house back!
  Okay! Right after I get a girlfriend.| Aw! All right, you big crazy. It's a deal.
  | Jake, what time is it?!
  Lady time! | Okay, Snorlock, if you want a lady, you have to be yourself.
  How do I be myself?| Uh, how does he be himself, Jake?
  Finn, you see any hot mamas?|  Ummm... Baaaaaam!
  He's got this.| Yeah.
  Girlfriend! Girlfriend! Girlfriend! Girlfriend! Girlfriend! Girlfriend!| Dude! our house! We got to do something!
  Aw, who could leave you? Come here, you big hot mess. | Break it up, you two! We have ladies to attend to!
  No, it's not. Check it out, Snorlock. Finn, you be the guy snail, and I'll be...  the chick snail.| Ugh! gross, Jake!
  | Okay. I'll do it for this guy.
  |  What's up, lady snail?
   Well, I'm just sitting here thinking about mating with snails.| No! I can't do this, man! I-am-out!
   Hey, baby. What's up?| Uh... WHA!
  Mm-mmm!  mm-mmm!  Girl, you smell good. Did you take a bath in rainbows and cupcakes?| 
"  Say ""yes""!  Say ""Yes""!  Say ""YES""!  Say ""Yes""!"| Okay! Yes!
  Man, I wish you guys were ladies.| Uhh.
  Umm, hey, Finn, teach him how to use swords. The princesses always love this one.|  Yah! yah! yah! yah! Yaaaah! hyah!
  Yeah, Snorlock! Show us that talent!| Whoo-hoo!
  Oh, my! What is that? What is that wonderful sound? Do I see swords?| Jake, these chicks look pretty serious.
  Look at him go! Bringing in the ladies.| Uh, he's bringing in a lot of ladies.
  | Snorlock! These ladies are ruining our tree house! Stop!
  Wedge, dude!|  
   It's no use, man. It's stuck with snail slime.| 
  Finn! Aah! | How are we gonna get our house back?
   Dude, I'm going in.| Wha? Jake! No! You'll get slimed or grinded on!
   Hmph!|  
  Me, a slug?| Yeah, man. That's why you have trouble with snail chicks. You need slug chicks.
  I don't know why they have to make out so close to our house.| I don't know. Come on, let's finish rebuilding it. I got some ear plugs you can borrow.
  I don't know. Come on, let's finish rebuilding it. I got some ear plugs you can borrow.| Where's that music coming from?
   Go! go! go! go!| BMO! Get over here and help us rebuild the tree house.
  Yup!| Good, 'cause we're gonna need it for this... ROOF PARTY!  Watch this, everybody! Triple flip with chips for the dip! 
  I said you don't FOCUS AT ALL! Hey, Finn, do another flip.|  YUP! YAH!
  Hahaha!! You're a dynamo, Finn!!| YEAH!! I NEVER SLOW DOWN!!
"  ""Never slow down?"""| Whoa. Dude, can you, like, get offa' me?
   Do you think your energy could be used to power a huge machine?| I guess so, man.  Hey, Jake  Your friend is super weird, dude.
  It's starting, everyone! The celestial alignment!|  Jake! That party was super fun! 
  Man, I'm sleepy. | Then go to sleep, man!
  Huh? Oh, yeah, right.  Goodnight, homie.|  Hyump! Ahh!  Goodnight, hamlet. 
  Welcome, Finn.| Huh?  UNTIE ME SO I CAN BEAT YOU WITH THAT SACK!!  You're that—
  And...  ruler of the Beneathaverse!|  'S pretty nice. Hey, why don't you guys just untie me, and we can pretend this whole thing didn't happen?
  Oh, no! I've been searching all over Ooo for the perfect power source! A living dynamo! Something that... never slows down.| Uh-oh.
  And last night, I finally found—|  It's me.
  Yes!! It's you!! You will have the great honor of powering the Upturnoverdrive!| That does what now?
  It will flip over the entire world! Then we'll be the ones on top, buddy!| THAT'S BIZONKERS!
  Yes, but the engineering is very sound.|  Huh?
  Your energies will be harnessed by our most advanced technology. The Cyclonic Rodentarod!| Ha! You may have captured me... Hugh!  ...but you can't make me run!  Ow! Well... you can't make me run very fast.  OW!! Jake's on his way to mess you guys  UUUOOOOAAAHH!!
  Congratulations. You fully charged the Alternator! Now it's time to power up the Plasma Ball... with sexy, fun dancing!| NO! STOP! NOOOOO!!!! WHA! AAH!! 
  All finished.| Finished, huh?  Finished... Finished... Fin... Fin... Finn...  AWWW, FINN! Darn it! My best friend's missing! I gotta get my head together!  Touching.  Tasting.  Looking.  Little footprints! Too small to be Finn's... More like a bunch-a'-gnomes-carrying-something footprints!
  Now... for the final stage!  The brain machine!!| NO.
  YES! THIS MACHINE WILL SUCK THE ENERGY FROM YOUR THOUGHTS!  ...To start our Upturnoverdrive.|  Don't think, Finn... Don't think anything.  Can't... let... them... WIN!!  No more games. No... more... PAJAMAS!!! 
  NOOOOO!!!| Jake?!?!
  LET'S KICK IT!! | Wha?!
  HAH-HAH!  I BET I CAN LIFT THIS THING!!  WAAAAHH!!!| Jake?!  JAKE!!!  You defeated the Gnomes!!
  I did?!| Yeah, man!!
  And you're okay?!| Yeah, man, I'm fine!!!
  Haha! Then I did it! I saved you by being an unfocused, rowdy party dog!| Hahaha, yeah, dog!!
 ♪Apple pie in the oven, Tell me you can taste lovin'♪|Hmm...
 Yo, man, what's going on?|I found this crystal on our door step, it's pretty mysterious, I'm trying to find information about it using the holobook.
 Oo, that's cool, but do you know what's really cool? Tough Guy contest!  Whoo-hoo!  Tough Boys!| Wait man, doesn't this look like Tree Trunks' lipstick?
 That's impossible, Tree Trunks exploded in the scary dark forest after she ate that Crystal Gem Apple, remember?|Yeah, I remember. 
 Come on man! Tough Guy contest me!|Ha! 
  you got what it takes to rip-it?!|Uh, yeah! 
 Then let's get it on!|Yeah-yo!
  Do it, Finn, do it! |
 |  Noooooo!
 I'm gonna break out! |No way!
  I'm breaking out of my fat!  I win, Finn! Finn?  Finn, Finn! Are you okay?! |
  I was just messing with ya, dude.| I... was just... messing with... you  
  Are you okay?| Yeah,  I'm just going to rest my muscles. 
 | 'Sup, dude?
 Finn, you're okay! I was afraid I mashed your potatoes too hard last night.|Ha, you didn't mash my potatoes!  You didn't even make me cry silently into my pillow last night for- thirty minutes. In fact, you read to go again tough stuff?!
 Nope, no more, dude.|What?!
 I never wanna lose control again, man! I'm going totally soft |You look like a wuss!
 Mmm hmm.|  Hey, the crystal is glowing a different color! 
 Whoa...|Chip-chap-chop, what's going on?!
 Uh, which one of you is Finn the Human?|It depends on who's asking, are ya'll good or evil?
 Uh, we're good.|Oh, I'm Finn
  Hey, you guys, put my bro down.|Jake! 
 Finn! |Hey!
 Hey, man, what happened?|I don't know, but I'm trapped in this crystal ball, get me out of here!
 Um, well, it's a secret but part of it is we're turning Finn into a crystal.|Jake, you can stop these guys now! 
 Ah, man!| get me out of here!
 No, dad, I gotta control myself!  Control, control, control, con-trol.| Help! My arm! 
 Yeah, man. | JAKE, HELP!
  Yeah. Yes|Don't make fun of him, he's having problems, everybody has- 
 So, help me I will touch you!| JAKE! AHH! HELP!!
  cut it out he looks good.|MY BODY!!  
  I'm sorry, Finn, I'm super lame and now...you're dead.|I'm not dead, I'm just all crystal stiff.
 That voice.|It sounds like-
  Yes, Finn, it's me, Tree Trunks.  but in this world I am known as Quartzion the Crystal Queen.|Oh my grosh, you're alive!
 Yes, yes I know, but you love... is not enough   I wanted you, Finn, so you could be transformed into my sexy crystal king.|Tree Trunks, you've gone bananas with crystal power!
 Finn, it's not sexy for a king to call his queen bananas! |Jake, you totally gotta stop her!
 Whoa there, don't you put your junk on my trunk! |Go, Jake, go!
 Oh, well then I'm over it then! Rarr |Jake, kick Tree Trunks in the tummy, shes probably still got that crystal gem inside her!
  Oh, dear.|
 Oh shush, Tree Trunks, if I had a penny for every time someone went crazy hopped up on magic energy... I'd be Abraham Lincoln!|Tree Trunks, you're okay!
 Finn!|I'm okay toooo! 
 Oh, Finn, I was trapped here for so long and all I could think about was you and how your so nice to me and I, and I just wanted to say... I think... you're cute and I like you.| Okay, okay, let's go.
 Finn, when we get home, it's apple pie time.|Ooooh!! 
 Hey Princess! Here I go!  I'm stuck.|Princess, let us deliver the tarts.
 Are you sure Finn? This is really important.| Princess, I have never been more sure of anything in my whole life!  I'll do anything it takes to keep you alive and safe. We won't let you down.
 Welcome to the Tartorium!| Wow.  They're so beautiful.
 Now, I want you to tote those tarts through that tunnel.  The Royal Tart Path takes you directly to the Royal Congressional Hall in the Bad Lands. The path is really safe and well protected, but keep your eyes open for any sign of danger, okay?|Mmm hmm.
 Good. Now here's your map. | Hey Princess, what are all these bubbling chemicals all over the place?
 That's paralyzing potion, Finn! Don't touch it. It'll paralyze you forever! |Oh. 
 All right, let's hit it. |Wait. I got a sick plan! 
 Wait. I got a sick plan! |Go!
 Okay.  Bye! Bye-bye! Bye-bye! Bye!| Goodbye! You'll be fine! Hahaha!
  Heh, that was fun, but why'd you do it?| Look, everyone expects the tarts to on that Royal Tart Path. Cinnamon Bun will be our decoy while we take the one path no thief expect a tart toter to take
  I guess this is it.| Huh, not as scary as I thought it'd be.
  Yeah, man, mostly just looks empty. I mean, what thief would ever hang out here? There's nothing to steal!| You know, I think my plan might be kinda brilliant. I mean, I'm not saying I'm the brilliant, but it's a pretty brilliant plan, I think.
  True, true. This place is perfect for toting tarts.| Yeah, and the Back-Rubbing Ceremony is right over those mountains.  This tart tote is gonna be a total tart walk.
  Heheheh, yeah. Ohh, wait! Hold up!| What is it?
  Shh.  It's a campfire—close by.|  Does it smell like a tart thief's campfire?
  Maybe.| Better check it out—can't be too careful. 
  Hush.  I ain't gon' burn it.| Crud! I was sure we'd be safe in the Desert of Doom!
  What? Whatcha sayin'?| Those are dirty tart burglers!
  I think they're just dirty hobos.| No, man, they are cold-blooded tart destroyers and we have to get them before they get us.
  Why?| They're gonna kill Princess Bubblegum by stealin' our tarts!
   You got tarts?| You know we do! And the next time you want to steal one—!  You picture this guy right here  chewin' on your brain!  What the—?!  That thing's gettin' the tarts!
  You know we do! And the next time you want to steal one—!  You picture this guy right here  chewin' on your brain!  What the—?!  That thing's gettin' the tarts!| Son of a—.
  Uh-oh, man, he got, like, five or six!| But... my brilliant plan.
  Incoming transmission from Princess Bubblegum.| What the—? 
  Hey, Finn.|  
  I'm just checking in using the holo-pendant. How are my tarts doing?| They're, um... th-they're—
  They're radical! No tart problems here!| Uhh, yeah! Right! Everything's, uh—bazoobs! Oh, look, something is eclipsing the sun. It's so dark now. 
  I think the plan went awry.| No! All this was just some freak bad luck, but we still got some tarts and the princess is still safe.
  Okay.| You know what? Even though it totally wasn't our fault, it's probably for the best that we lost those tarts. 
  Huh? How?| Well, it's like a reminder to really stay sharp and play it extra safe.
  Well, it's like a reminder to really stay sharp and play it extra safe.| For instance, take this scary cavern, here. No sane person would ever bring a tart down there. So...
  So no thieves!| Exactly.
  Yeah, P.U.!| Jake?
  Yeah?| Hey, man, did you just, like, sniff my butt?
  Uh, just now?| Yeah.
  No.| Huh. Alright.
  Hmm. Hey, Finn?| Yeah, Jake?
  Did you just, uh, lick me—all the way up my arm?| No.
  Hmm. Strange.| Jake, let me see those matches.
  Uh-oh! Man, we got got! There's only two left!| What?!
  Incoming transmission from Princess Bubblegum.| Aaaaah!
  Hello?| We blew it, man! My plan sucked—it sucked all along—but I was blinded by my hubris! Now PB is gonna get got, and it's all my fault!
  Whoa, whoa, take it easy, buddy. We've still got two whole tarts left. PB is gonna be fine.| You really think so?
  Hey! Keep off them tarts!| Huh?
  I said back off of them tarts! Are you an imbecile?!| But I—
  Yeah! That's it. Alright,  now I gotta book it to Nana's for brunch! See youse later!| It's over. PB's gonna get croaked.
  Mmm, yeah—or... we could smash in there and stop Congress from chopping her head off.| You're right! Jake, let's go save Princess Bubblegum!
  Chop! Chop! Chop! Chop!| NOOOOO!!!!
  NOOOOO!!!!| Aaaaah! ... Huh?
  Let the annual Back-Rubbing Ceremony begin!| Dude, they were just slicing tarts!
  Hey!| He must have delivered the decoys...
  the ones we poisoned!| Nooo!
  Nooo!| Princess, don't eat that tart!
  Okay! Jeez, Finn, I won't eat that tart. I'll eat this other tart instead!| No, Princess, no!
  No, Princess, no!| The princess has been paralyzed!
  I'm not paralyzed! I'm gripped with the flavor!| That means we must have been carrying the poisoned tarts all along!
  That means we must have been carrying the poisoned tarts all along!| Yep! All part of my master plan.
  Excuse me! What is this about poisoned tarts and alternate plans?| I-I—alright, here it comes.  I had a brilliant plan to tote the tarts along a dangerous path, but I mucked it up.  You oughtta give this toter job to Cinnamon Bun. He's the real hero.
   Yeah! | I'm sorry for not following your instructions and for lying to you about it.
  Oh, Finn, I forgive you—'cause I lied to you, too! They weren't going to decapitate me; I just said that so you guys wouldn't eat the tarts!| Oh!
  So I guess we're even.| Uhh, yeah, I guess so.
  Hello? Eat my tarts? This cosmic dance of bursting decadence and withheld permissions twists all our arms collectively, but if sweetness can win—and it can— then I'll still be here tomorrow, to high-five you yesterday, my friends. Peace.| Sheesh!
  Coming up.  I know what you're thinking about.|  Huh?
  Kissin' Princess Bubblegum on the mouth!|  No, I'm not! And... I wouldn't even do that ever.
  Yeah, you would. You're just bad at talking to ladies.| Hmmph.  Ehggg-uh-ya-uh. Uh, should I keep going, Mrs. Yoder?
   No, Finn, that's plenty. Thank you.| Okay.  Let us know if you need anything else. Hyah!
  You two are heroes!|  Hunh.
  Come on, dude.| Hey! Do you hear that? She called us heroes!
  Hey! How's it going?!  Ugh! Is that true, what the bird said? You guys are heroes?| Why were you hiding in that shrub?
  So listen, I need you two heroes to get me a lock of princess hair. | Why do you need princess hair?
  Anyway, I need the princess hair so I can put it on my head.  And then I'll be beautiful.| Oh, well, uh, we know lots of princesses.
   Dude, I don't think we should help her.|  Why not?
  'Cause she's a witch!| Maybe she's a good witch.
  Are you guys still talking?!| So what do we do? Tell her we can't help her 'cause she's ugly?
  We were just saying someone as pretty as you doesn't even need a full head of hair.  Isn't that right, buddy?| Uh, yeah, totally!
  Oh. Umm…| Dude, I don't think it's working.
  Hmm.| Look, Lady, we can't help you get princess hair.
  Why not?| Because... we only help when someone's in danger. 
  I told you she was evil!| Grrrrrr.... Yaah!
  What, you forget I'm a witch?| Maybe.
  Nyuh! Get some princess hair!!| All right, fine! 
  Wait! Uh, you... you can't tell anyone why you need it.| What? Why?
  I don't want anyone to know I have a balding problem.| O...kay. 
  O...kay. | It's Princess Muscles's castle! 
  Hi, Finn.| Uh, hey, Princess Muscles.
  What brings you by?| Um, you were the nearest princess, and I need a lock of your hair.
  I understand.| You do?
  Mm-hmm. | Aah! What are you doing?
  Trying to give you a hug.| Why? I want hair, not hug!
  Oh, I see. You want to take things slo-o-o-w.| No! I--I'm here to save you! From your hair! It looks really bad. Cut it off, quick!
  Of course it looks bad. If I had beautiful, shiny hair, no one would look at my muscles.  Come back when you wanna get serious about loving me!| I am terrible at talking to ladies.
  I am terrible at talking to ladies.| Hmm... Where's a princess? Princess?... Princess... Princess... Who's that?  It's Lumpy Space Princess.  Does she... live in the woods now?
   G-G-Get away from my camp! I'll cut you! Hrm. I'm never gonna go back home.| Huh. Wait. Does she even have hair?  She does! Well... hair is hair.
  Oh, my Glob! What the stuff are you doing?! Why are you cutting my lumps?!| Because they're, uh... So--
   I knew you liked me.| No, I don't! I-I'm just stopping by because--
  Just admit it, Lover Boy! You can't resist me! Well, if you want these lumps, you gotta put a ring on it! Where's my ring?!  I knew you liked me, Finn. That's why you're running! Get in touch with your feelings, babe!|" What am I gonna do? Huh? A graveyard? Yes! There's got to be a hairy princess in there that won't think I'm hitting on her! Princess? Princess? Princess? Ugh! Come on! Bingo!  ""Here lies Princess Beautiful. She was so beautiful."" Hey, that's perfect! And sort of macabre. Oh, well.  Aha! "
  Hi, Finn.| Ohh!
  What? What are you -- Please stop.| Where's her hair?!
  Thanks, Finn. |" ""Here lies Princess Beautiful. She was so beautiful, but died of baldness?!"" Dang it!"
   I'm gonna look so beautiful... Invited to all the parties.|  Jake! Jake! I'm sorry, man. Getting princess hair is -- is impossible! They all just think I'm in love with them! Ugh! I can't do it. You're gonna have to spend the rest of your life in this witch's butt.
   Dude, if they think you like them, then use that. Embrace it! Find the least terrible princess you can, play her some music, cook her a meal, smoove talk her until she likes you. And then get the hair!| Wait. You mean like go on a date?
  Marry a princess if you need to! Just get her hair! Aaaah!| Jake!
   Go get the hair!| Okay! Hold on!
  Okay! Hold on!| Princess Bubblegum!
  Hi, Finn!| Uh... I need you to come with me!
  Why? I'm watering right now.| Just come on. We don't have much time!
  What is this, Finn?| We're gonna have a spaghetti dinner.
  Um, Finn?| Put your butt here! Hurry!
  Oh. | Hey, Simon, make it romantic.  Oww! Here, shove this in your mouth! It's hot!
  Finn, I don't understand--| Please, Princess! Just stick it in your mouth!
  Well, okay.   You're lucky I love spaghetti!| Um, Princess... do you like me?
   Finn, of course I like you.| Really?
  Yeah!| Yes! Now give me some of your hair!
  Oh, Finn, that's sweet. Sure, I'll give you some of my hair.  Here. Take it, you cutie.| Thank you, Princess Bubblegum!! 
"  My cat had kittens... and I'm thinking of naming one ""Little Whiner."" What do you think? Is that a good name?"| Totally did it! Genuine princess hair. You hear that, Jake?
   Just give it to her, already!!| All right, lady, a deal is a deal.
  What?!| It is bubblegum!
  Aaaah!| WAAIT!
  What?| If I learned anything today, it's that I'm awesome at talking to ladies! And, lady, you are crazy ugly!
  Duuuude!| Having beautiful hair isn't gonna get you anywhere, because you're ugly, inside and out, so ugly I want to throw up.
  Duuuude!| No one will ever find you beautiful. everrr! And it's got nothing to do with the ol' chrome dome. It has to do with what's in here.  Can you get off my friend now?
  Well, don't get me wrong. I know I'm ugly. And evil.  But I thought if I had some beautiful hair, I could learn how to love myself.| Gee... I feel kind of bad.
  I don't.| Hey, witch! Does it have to be princess hair?
  No. Just beautiful hair.| Well then, check this out!  HA HA-A-A-A-A-A!!!
  You'd really give me your hair?| Sure!
   So... how do I look?| Totally beautiful.  inside and out!
  Thank you, Finn. And now to use my hair for evil.|  What?!
  And if I do this hand position,  my boogers should turn into smoke bombs.|Pfff. You sure this tip is good, Flambo?
  Come on, you know I'm on the level. The Ice King is scheming to nabs a princess today. I swears it.|Hmm.
  Ninjas? Ninjas ain't real for nothing, no how.|Whoa, now—ninjas are real. For you see,  Doo, doo, doo... Jake and I are ninjas.
 Yep, ever since we fished this ninja manual out of a ditch. Finn, booty me!| Listen!
 Wenk, wenk!|It's the Ice King, all right, and he's looking awful pleased with himself.
 Uh-oh. If the Ice King's so happy, he must have stolen a princess when we weren't looking, somehow.  That's ninja logic.|Then we gotta...
  Ahem.|...we gotta save that princess.
 You got it, shino-bro! Ninja kick!|Ninja kick!
 Ninja kick!|Princess? Princess!
  Princess?| Princess!
 No princess here, man.|No princess?  It's... a trap! We're being trapped! Ninja vanish! Evade! Evade!
 Nothing is trapped, dude. We can't find any captured princesses, because the Ice King hasn't captured one yet. He's out doin' it right now.|Are you sure?
  No. It's only a ninja hunch, so we should ninja snoop for proof.|Wait, man. I-I feel uncomfortable snooping through Ice King's personal stuff. It feels sorta like...  a violation.
  Whoo! Got the Ice King's diary.| No, no, no, no, no! We can't read his private junk! 
 And yet we must.  Dear diary—and you better write me back this time!—  today I'm bringing home a special new cutie.|There's our proof, man! ... Hmm, alright. Let's use our ninja stealth and hide until he comes back with the princess.
 Or... we could keep looking through his stuff. Heh, heh, heh! You know, for more proof? Hehehe!|No.  Alls we're gonna do is lie in wait until the Ice King gets back. Then—BOOM —we catch him with princess on his hands. 
 Where are we gonna hide?|In this filthy hamper!  Think he's there yet?
 In this filthy hamper!  Think he's there yet?|See anything?
 Nah. Hey, Finn, I don't want to hide in the hamper anymore; it reeks in here.|But we're ninjas! And this is our ninja hideout.
 Nah, man. My sense of smell is, like, one thousand times better than yours. Also, the hamper's boring. I'm out.|Wait!
 I'm out!|Jake! Get back here!   Hey, wait up!
 Check this out!|Weird.
 I want to draw something.|Hey!  We gotta leave no trace! Ninjas leave no trace!
 I'll delete it after!|Hey, come on!
 Hey, come on!| Jake, what have we done?
 What kind of guy builds a cave inside of another a cave?  What's this? A spellbook?  Whoo!|Dude! Leave no trace!
 Ah, it's too late for that.|It's not too  ...late. WHOA!
 What'cha got there?|Dude! It's a first-edition Ice Ninja Manual!
 Dude! It's a first-edition Ice Ninja Manual!| A true ninja passes no wind; he only passes... 
  I ain't even heard of these techniques.  Nuh-nuh-n-numm-nuh  numb-chucks.|Hey. Ice King seems way into ninjas, even more than we are.
  Yeah, so? |So... doesn't that mean that ninjas must be... kinda lame?
 Nah, they're still cool. But Ice King's still lame because he hides his ninja love. We wear our ninja on our sleeves! |Jake! Show me how to do that.
 Other| Fridjitsu master Finn summons... dagger of chilled glass. 
  Fridjitsu master Jake summons... stars of frozen rain.  Get ready to be... star struck. |Get ready to be... cold cut!
 Hyah!| Kunai attack!
  Icicle kick!| Force of blizzard!
  Flying jump!|What?! Three Jakes? That's one too many. Caltrop hailstorm!  Those Jakes were all fakes!
  Heh! Fridjitsu master Jake summons... arrow of ice! |Hiyah!  Rad.
  WOOHOO! YEAH!|It's the Ice King! Hide!
 Other|  He's got a princess. Now we leap out and catch him red-handed. 
 Hai!|Snow blind! 
 Other|Ice King, hand over that princess!
 Other|Jake, where's the princess?
 Other|The, um... princess you were just talking to?
 Other|Ohh...
 Other|No princess?
 Other|We messed up, Jake. We're... violators!
 Other|We're... ninjas?
 Other|It's true.  Ice King, we're gonna make this right.
 Other|Doctor Princess!
 Other|What's goin' on?
  I don't know if stomachs work like that, dude.| Sometimes it helps.
  Can't argue with that!  Ahh...|  Ahh...
   Hello? Lady, it's gonna be fine. Mm-hmm. Alright, I love you, too. Bye. | Lady Rainicorn again?
  Yeah, man. She's worried about introducing me to her parents at lunch today. She thinks they're gonna freak out.| Um... maybe give her parents some treasure?
  No way! That's our treasure! Wait. I've got it, dude! I'll invite them over early, smooth them over using my personality, and we'll all be best friends before Lady gets here so she doesn't have to feel nervous! It's perfect! I'll just send them a quick Prism-gram.  Mm-hmm. | What's it say?
